"Downloaded on",02/17/2020,"11:58:18 EST"
"Search URL",https://www.congress.gov/search?s=2&searchResultViewType=expanded&KWICView=false&q=%7B%22source%22%3A%5B%22legislation%22%5D%2C%22chamber%22%3A%22Senate%22%2C%22congress%22%3A%5B%22116%22%2C%22115%22%2C%22114%22%2C%22113%22%2C%22112%22%2C%22111%22%2C%22110%22%2C%22109%22%5D%2C%22bill-status%22%3A%5B%22law%22%5D%7D

"Legislation Number",URL,Congress,"Amends Bill",Title,Sponsor,"Date of Introduction","Date Offered","Date Submitted","Date Proposed","Number of Cosponsors",Committees,"Latest Action Date","Latest Action"
"S. 3201",https://www.congress.gov/bill/116th-congress/senate-bill/3201,"116th Congress (2019-2020)",,"Temporary Reauthorization and Study of the Emergency Scheduling of Fentanyl Analogues Act","Sen. Graham, Lindsey [R-SC]",01/16/2020,,,,6,"House - Energy and Commerce, Judiciary, Ways and Means",02/06/2020,"Became Public Law No: 116-114."
"S. 2710",https://www.congress.gov/bill/116th-congress/senate-bill/2710,"116th Congress (2019-2020)",,"A bill to prohibit the commercial export of covered munitions items to the Hong Kong Police Force.","Sen. Merkley, Jeff [D-OR]",10/24/2019,,,,17,"Senate - Banking, Housing, and Urban Affairs",11/27/2019,"Became Public Law No: 116-77."
"S. 2249",https://www.congress.gov/bill/116th-congress/senate-bill/2249,"116th Congress (2019-2020)",,"A bill to allow the Deputy Administrator of the Federal Aviation Administration on the date of enactment of this Act to continue to serve as such Deputy Administrator.","Sen. Wicker, Roger F. [R-MS]",07/24/2019,,,,0,"House - Transportation and Infrastructure",08/02/2019,"Became Public Law No: 116-38."
"S. 2047",https://www.congress.gov/bill/116th-congress/senate-bill/2047,"116th Congress (2019-2020)",,"A bill to provide for a 2-week extension of the Medicaid community mental health services demonstration program, and for other purposes.","Sen. Schumer, Charles E. [D-NY]",06/27/2019,,,,0,,07/05/2019,"Became Public Law No: 116-29."
"S. 1838",https://www.congress.gov/bill/116th-congress/senate-bill/1838,"116th Congress (2019-2020)",,"Hong Kong Human Rights and Democracy Act of 2019","Sen. Rubio, Marco [R-FL]",06/13/2019,,,,56,"Senate - Foreign Relations",11/27/2019,"Became Public Law No: 116-76."
"S. 1790",https://www.congress.gov/bill/116th-congress/senate-bill/1790,"116th Congress (2019-2020)",,"National Defense Authorization Act 
for Fiscal Year 2020","Sen. Inhofe, James M. [R-OK]",06/11/2019,,,,0,"Senate - Armed Services",12/20/2019,"Became Public Law No: 116-92."
"S. 1749",https://www.congress.gov/bill/116th-congress/senate-bill/1749,"116th Congress (2019-2020)",,"Protecting Affordable Mortgages for Veterans Act of 2019","Sen. Sinema, Kyrsten [D-AZ]",06/05/2019,,,,1,"House - Financial Services, Veterans' Affairs",07/25/2019,"Became Public Law No: 116-33."
"S. 1693",https://www.congress.gov/bill/116th-congress/senate-bill/1693,"116th Congress (2019-2020)",,"National Flood Insurance Program Extension Act of 2019","Sen. Kennedy, John [R-LA]",05/23/2019,,,,0,,05/31/2019,"Became Public Law No: 116-19."
"S. 1689",https://www.congress.gov/bill/116th-congress/senate-bill/1689,"116th Congress (2019-2020)",,"A bill to permit States to transfer certain funds from the clean water revolving fund of a State to the drinking water revolving fund of the State in certain circumstances, and for other purposes.","Sen. Booker, Cory A. [D-NJ]",05/23/2019,,,,1,"Senate - Environment and Public Works",10/04/2019,"Became Public Law No: 116-63."
"S. 1436",https://www.congress.gov/bill/116th-congress/senate-bill/1436,"116th Congress (2019-2020)",,"A bill to make technical corrections to the computation of average pay under Public Law 110-279.","Sen. Brown, Sherrod [D-OH]",05/13/2019,,,,2,,06/12/2019,"Became Public Law No: 116-21."
"S. 1379",https://www.congress.gov/bill/116th-congress/senate-bill/1379,"116th Congress (2019-2020)",,"Pandemic and All-Hazards Preparedness and Advancing Innovation Act of 2019","Sen. Burr, Richard [R-NC]",05/08/2019,,,,3,"Senate - Health, Education, Labor, and Pensions",06/24/2019,"Became Public Law No: 116-22."
"S. 1196",https://www.congress.gov/bill/116th-congress/senate-bill/1196,"116th Congress (2019-2020)",,"A bill to designate the facility of the United States Postal Service located at 1715 Linnerud Drive in Sun Prairie, Wisconsin, as the ""Fire Captain Cory Barr Post Office Building"".","Sen. Baldwin, Tammy [D-WI]",04/11/2019,,,,1,"House - Oversight and Reform | Senate - Homeland Security and Governmental Affairs",10/31/2019,"Became Public Law No: 116-66."
"S. 998",https://www.congress.gov/bill/116th-congress/senate-bill/998,"116th Congress (2019-2020)",,"Supporting and Treating Officers In Crisis Act of 2019","Sen. Hawley, Josh  [R-MO]",04/03/2019,,,,21,"House - Judiciary | Senate - Judiciary",07/25/2019,"Became Public Law No: 116-32."
"S. 863",https://www.congress.gov/bill/116th-congress/senate-bill/863,"116th Congress (2019-2020)",,"A bill to amend title 38, United States Code, to clarify the grade and pay of podiatrists of the Department of Veterans Affairs.","Sen. Cassidy, Bill [R-LA]",03/25/2019,,,,1,"House - Veterans' Affairs",04/08/2019,"Became Public Law No: 116-12."
"S. 862",https://www.congress.gov/bill/116th-congress/senate-bill/862,"116th Congress (2019-2020)",,"Rebuilding Small Businesses After Disasters Act","Sen. Kennedy, John [R-LA]",03/25/2019,,,,3,"Senate - Small Business and Entrepreneurship",11/22/2019,"Became Public Law No: 116-70."
"S. 744",https://www.congress.gov/bill/116th-congress/senate-bill/744,"116th Congress (2019-2020)",,"Effective Prosecution of Possession of Biological Toxins and Agents Act of 2019","Sen. Grassley, Chuck [R-IA]",03/12/2019,,,,3,"House - Judiciary | Senate - Judiciary",07/25/2019,"Became Public Law No: 116-31."
"S. 737",https://www.congress.gov/bill/116th-congress/senate-bill/737,"116th Congress (2019-2020)",,"Building Blocks of STEM Act","Sen. Rosen, Jacky [D-NV]",03/11/2019,,,,8,"Senate - Commerce, Science, and Transportation",12/24/2019,"Became Public Law No: 116-102."
"S. 725",https://www.congress.gov/bill/116th-congress/senate-bill/725,"116th Congress (2019-2020)",,"A bill to change the address of the postal facility designated in honor of Captain Humayun Khan.","Sen. Kaine, Tim [D-VA]",03/07/2019,,,,1,"House - Oversight and Reform",04/16/2019,"Became Public Law No: 116-15."
"S. 693",https://www.congress.gov/bill/116th-congress/senate-bill/693,"116th Congress (2019-2020)",,"National POW/MIA Flag Act","Sen. Warren, Elizabeth [D-MA]",03/07/2019,,,,7,"House - Judiciary | Senate - Judiciary",11/07/2019,"Became Public Law No: 116-67."
"S. 504",https://www.congress.gov/bill/116th-congress/senate-bill/504,"116th Congress (2019-2020)",,"Let Everyone Get Involved in Opportunities for National Service Act","Sen. Sinema, Kyrsten [D-AZ]",02/14/2019,,,,35,"House - Judiciary | Senate - Judiciary",07/30/2019,"Became Public Law No: 116-35."
"S. 483",https://www.congress.gov/bill/116th-congress/senate-bill/483,"116th Congress (2019-2020)",,"Pesticide Registration Improvement Extension Act of 2018","Sen. Roberts, Pat [R-KS]",02/13/2019,,,,2,,03/08/2019,"Became Public Law No: 116-8."
"S. 457",https://www.congress.gov/bill/116th-congress/senate-bill/457,"116th Congress (2019-2020)",,"President George H.W. Bush and First Spouse Barbara Bush Coin Act","Sen. Cornyn, John [R-TX]",02/12/2019,,,,66,"Senate - Banking, Housing, and Urban Affairs",01/27/2020,"Became Public Law No: 116-112."
"S. 256",https://www.congress.gov/bill/116th-congress/senate-bill/256,"116th Congress (2019-2020)",,"Esther Martinez Native American Languages Programs Reauthorization Act","Sen. Udall, Tom [D-NM]",01/29/2019,,,,10,"House - Education and Labor | Senate - Indian Affairs",12/20/2019,"Became Public Law No: 116-101."
"S. 252",https://www.congress.gov/bill/116th-congress/senate-bill/252,"116th Congress (2019-2020)",,"A bill to authorize the honorary appointment of Robert J. Dole to the grade of colonel in the regular Army.","Sen. Roberts, Pat [R-KS]",01/29/2019,,,,1,"House - Armed Services | Senate - Armed Services",04/06/2019,"Became Public Law No: 116-11."
"S. 239",https://www.congress.gov/bill/116th-congress/senate-bill/239,"116th Congress (2019-2020)",,"Christa McAuliffe Commemorative Coin Act of 2019","Sen. Shaheen, Jeanne [D-NH]",01/28/2019,,,,83,"Senate - Banking, Housing, and Urban Affairs",10/09/2019,"Became Public Law No: 116-65."
"S. 216",https://www.congress.gov/bill/116th-congress/senate-bill/216,"116th Congress (2019-2020)",,"Spokane Tribe of Indians of the Spokane Reservation Equitable Compensation Act","Sen. Cantwell, Maria [D-WA]",01/24/2019,,,,1,"House - Natural Resources | Senate - Indian Affairs",12/20/2019,"Became Public Law No: 116-100."
"S. 163",https://www.congress.gov/bill/116th-congress/senate-bill/163,"116th Congress (2019-2020)",,"Alaska Remote Generator Reliability and Protection Act","Sen. Sullivan, Dan  [R-AK]",01/16/2019,,,,1,"House - Energy and Commerce | Senate - Environment and Public Works",10/04/2019,"Became Public Law No: 116-62."
"S. 153",https://www.congress.gov/bill/116th-congress/senate-bill/153,"116th Congress (2019-2020)",,"Supporting Veterans in STEM Careers Act","Sen. Rubio, Marco [R-FL]",01/16/2019,,,,12,"House - Science, Space, and Technology, Veterans' Affairs | Senate - Commerce, Science, and Transportation",02/11/2020,"Became Public Law No: 116-115."
"S. 151",https://www.congress.gov/bill/116th-congress/senate-bill/151,"116th Congress (2019-2020)",,"Pallone-Thune Telephone Robocall Abuse Criminal Enforcement and Deterrence Act","Sen. Thune, John [R-SD]",01/16/2019,,,,84,"House - Energy and Commerce | Senate - Commerce, Science, and Transportation",12/30/2019,"Became Public Law No: 116-105."
"S. 50",https://www.congress.gov/bill/116th-congress/senate-bill/50,"116th Congress (2019-2020)",,"Columbia River In-Lieu and Treaty Fishing Access Sites Improvement Act","Sen. Merkley, Jeff [D-OR]",01/08/2019,,,,3,"Senate - Indian Affairs",12/20/2019,"Became Public Law No: 116-99."
"S. 49",https://www.congress.gov/bill/116th-congress/senate-bill/49,"116th Congress (2019-2020)",,"A bill to designate the outstation of the Department of Veterans Affairs in North Ogden, Utah, as the Major Brent Taylor Vet Center Outstation.","Sen. Lee, Mike [R-UT]",01/08/2019,,,,1,"House - Veterans' Affairs | Senate - Veterans' Affairs",03/21/2019,"Became Public Law No: 116-10."
"S. 47",https://www.congress.gov/bill/116th-congress/senate-bill/47,"116th Congress (2019-2020)",,"John D. Dingell, Jr. Conservation, Management, and Recreation Act","Sen. Murkowski, Lisa [R-AK]",01/08/2019,,,,15,,03/12/2019,"Became Public Law No: 116-9."
"S. 24",https://www.congress.gov/bill/116th-congress/senate-bill/24,"116th Congress (2019-2020)",,"Government Employee Fair Treatment Act of 2019","Sen. Cardin, Benjamin L. [D-MD]",01/03/2019,,,,44,,01/16/2019,"Became Public Law No: 116-1."
"S. 3777",https://www.congress.gov/bill/115th-congress/senate-bill/3777,"115th Congress (2017-2018)",,"Forever GI Bill Housing Payment Fulfillment Act of 2018","Sen. Boozman, John [R-AR]",12/18/2018,,,,10,,01/03/2019,"Became Public Law No: 115-422."
"S. 3749",https://www.congress.gov/bill/115th-congress/senate-bill/3749,"115th Congress (2017-2018)",,"Congressional Accountability Act of 1995 Reform Act","Sen. Klobuchar, Amy [D-MN]",12/13/2018,,,,3,,12/21/2018,"Became Public Law No: 115-397."
"S. 3661",https://www.congress.gov/bill/115th-congress/senate-bill/3661,"115th Congress (2017-2018)",,"75th Anniversary of World War II Commemoration Act","Sen. Inhofe, James M. [R-OK]",11/27/2018,,,,5,,01/10/2019,"Became Public Law No: 115-433."
"S. 3628",https://www.congress.gov/bill/115th-congress/senate-bill/3628,"115th Congress (2017-2018)",,"National Flood Insurance Program Extension Act","Sen. Kennedy, John [R-LA]",11/15/2018,,,,4,"Senate - Banking, Housing, and Urban Affairs",12/21/2018,"Became Public Law No: 115-396."
"S. 3554",https://www.congress.gov/bill/115th-congress/senate-bill/3554,"115th Congress (2017-2018)",,"A bill to extend the effective date for the sunset for collateral requirements for Small Business Administration disaster loans.","Sen. Kennedy, John [R-LA]",10/05/2018,,,,2,"Senate - Small Business and Entrepreneurship",11/29/2018,"Became Public Law No: 115-280."
"S. 3530",https://www.congress.gov/bill/115th-congress/senate-bill/3530,"115th Congress (2017-2018)",,"Museum and Library Services Act of 2018","Sen. Reed, Jack [D-RI]",09/28/2018,,,,23,"Senate - Health, Education, Labor, and Pensions",12/31/2018,"Became Public Law No: 115-410."
"S. 3509",https://www.congress.gov/bill/115th-congress/senate-bill/3509,"115th Congress (2017-2018)",,"Congressional Award Program Reauthorization Act of 2018","Sen. Enzi, Michael B. [R-WY]",09/26/2018,,,,1,,10/11/2018,"Became Public Law No: 115-268."
"S. 3508",https://www.congress.gov/bill/115th-congress/senate-bill/3508,"115th Congress (2017-2018)",,"Save Our Seas Act of 2018","Sen. Sullivan, Dan  [R-AK]",09/26/2018,,,,3,,10/11/2018,"Became Public Law No: 115-265."
"S. 3479",https://www.congress.gov/bill/115th-congress/senate-bill/3479,"115th Congress (2017-2018)",,"Department of Veterans Affairs Expiring Authorities Act of 2018","Sen. Isakson, Johnny [R-GA]",09/18/2018,,,,1,,09/29/2018,"Became Public Law No: 115-251."
"S. 3456",https://www.congress.gov/bill/115th-congress/senate-bill/3456,"115th Congress (2017-2018)",,"A bill to redesignate Hobe Sound National Wildlife Refuge as the Nathaniel P. Reed Hobe Sound National Wildlife Refuge, and for other purposes.","Sen. Nelson, Bill [D-FL]",09/18/2018,,,,1,"Senate - Environment and Public Works",01/10/2019,"Became Public Law No: 115-432."
"S. 3444",https://www.congress.gov/bill/115th-congress/senate-bill/3444,"115th Congress (2017-2018)",,"A bill to designate the community-based outpatient clinic of the Department of Veterans Affairs in Lake Charles, Louisiana, as the ""Douglas Fournet Department of Veterans Affairs Clinic"".","Sen. Cassidy, Bill [R-LA]",09/17/2018,,,,1,"Senate - Veterans' Affairs",01/03/2019,"Became Public Law No: 115-421."
"S. 3442",https://www.congress.gov/bill/115th-congress/senate-bill/3442,"115th Congress (2017-2018)",,"A bill to designate the facility of the United States Postal Service located at 105 Duff Street in Macon, Missouri, as the ""Arla W. Harrell Post Office"".","Sen. McCaskill, Claire [D-MO]",09/17/2018,,,,1,"House - Oversight and Government | Senate - Homeland Security and Governmental Affairs",12/13/2018,"Became Public Law No: 115-314."
"S. 3414",https://www.congress.gov/bill/115th-congress/senate-bill/3414,"115th Congress (2017-2018)",,"A bill to designate the facility of the United States Postal Service located at 20 Ferry Road in Saunderstown, Rhode Island, as the ""Captain Matthew J. August Post Office"".","Sen. Reed, Jack [D-RI]",09/06/2018,,,,1,"House - Oversight and Government | Senate - Homeland Security and Governmental Affairs",12/13/2018,"Became Public Law No: 115-313."
"S. 3389",https://www.congress.gov/bill/115th-congress/senate-bill/3389,"115th Congress (2017-2018)",,"A bill to redesignate a facility of the National Aeronautics and Space Administration.","Sen. Capito, Shelley Moore [R-WV]",08/27/2018,,,,1,"House - Science, Space, and Technology | Senate - Commerce, Science, and Transportation",12/11/2018,"Became Public Law No: 115-309."
"S. 3367",https://www.congress.gov/bill/115th-congress/senate-bill/3367,"115th Congress (2017-2018)",,"Department of Transportation Reports Harmonization Act","Sen. Thune, John [R-SD]",08/22/2018,,,,0,"Senate - Commerce, Science, and Transportation",01/03/2019,"Became Public Law No: 115-420."
"S. 3354",https://www.congress.gov/bill/115th-congress/senate-bill/3354,"115th Congress (2017-2018)",,"Missing Children's Assistance Act of 2018","Sen. Grassley, Chuck [R-IA]",08/16/2018,,,,9,"Senate - Judiciary",10/11/2018,"Became Public Law No: 115-267."
"S. 3247",https://www.congress.gov/bill/115th-congress/senate-bill/3247,"115th Congress (2017-2018)",,"Women's Entrepreneurship and Economic Empowerment Act of 2018","Sen. Boozman, John [R-AR]",07/19/2018,,,,12,"Senate - Foreign Relations",01/09/2019,"Became Public Law No: 115-428."
"S. 3237",https://www.congress.gov/bill/115th-congress/senate-bill/3237,"115th Congress (2017-2018)",,"A bill to designate the facility of the United States Postal Service located at 120 12th Street Lobby in Columbus, Georgia, as the ""Richard W. Williams, Jr., Chapter of the Triple Nickles (555th P.I.A.) Post Office"".","Sen. Perdue, David [R-GA]",07/18/2018,,,,1,"House - Oversight and Government | Senate - Homeland Security and Governmental Affairs",12/14/2018,"Became Public Law No: 115-319."
"S. 3209",https://www.congress.gov/bill/115th-congress/senate-bill/3209,"115th Congress (2017-2018)",,"A bill to designate the facility of the United States Postal Service located at 413 Washington Avenue in Belleville, New Jersey, as the ""Private Henry Svehla Post Office Building"".","Sen. Menendez, Robert [D-NJ]",07/12/2018,,,,1,"House - Oversight and Government | Senate - Homeland Security and Governmental Affairs",12/14/2018,"Became Public Law No: 115-318."
"S. 3191",https://www.congress.gov/bill/115th-congress/senate-bill/3191,"115th Congress (2017-2018)",,"Civil Rights Cold Case Records Collection Act of 2018","Sen. Jones, Doug  [D-AL]",07/10/2018,,,,3,"Senate - Homeland Security and Governmental Affairs",01/08/2019,"Became Public Law No: 115-426."
"S. 3170",https://www.congress.gov/bill/115th-congress/senate-bill/3170,"115th Congress (2017-2018)",,"CyberTipline Modernization Act of 2018","Sen. Cornyn, John [R-TX]",06/28/2018,,,,12,"House - Judiciary | Senate - Judiciary",12/21/2018,"Became Public Law No: 115-395."
"S. 3119",https://www.congress.gov/bill/115th-congress/senate-bill/3119,"115th Congress (2017-2018)",,"Endangered Salmon Predation Prevention Act","Sen. Risch, James E. [R-ID]",06/21/2018,,,,5,"Senate - Commerce, Science, and Transportation",12/18/2018,"Became Public Law No: 115-329."
"S. 3031",https://www.congress.gov/bill/115th-congress/senate-bill/3031,"115th Congress (2017-2018)",,"Federal Personal Property Management Act of 2018","Sen. Peters, Gary C. [D-MI]",06/07/2018,,,,5,"Senate - Homeland Security and Governmental Affairs",01/03/2019,"Became Public Law No: 115-419."
"S. 3029",https://www.congress.gov/bill/115th-congress/senate-bill/3029,"115th Congress (2017-2018)",,"PREEMIE Reauthorization Act of 2018","Sen. Alexander, Lamar [R-TN]",06/07/2018,,,,12,"House - Energy and Commerce | Senate - Health, Education, Labor, and Pensions",12/18/2018,"Became Public Law No: 115-328."
"S. 3021",https://www.congress.gov/bill/115th-congress/senate-bill/3021,"115th Congress (2017-2018)",,"America's Water Infrastructure Act of 2018","Sen. Klobuchar, Amy [D-MN]",06/07/2018,,,,1,"House - Transportation and Infrastructure | Senate - Environment and Public Works",10/23/2018,"Became Public Law No: 115-270."
"S. 2961",https://www.congress.gov/bill/115th-congress/senate-bill/2961,"115th Congress (2017-2018)",,"Victims of Child Abuse Act Reauthorization Act of 2018","Sen. Blunt, Roy [R-MO]",05/24/2018,,,,21,"Senate - Judiciary",01/07/2019,"Became Public Law No: 115-424."
"S. 2946",https://www.congress.gov/bill/115th-congress/senate-bill/2946,"115th Congress (2017-2018)",,"Anti-Terrorism Clarification Act of 2018","Sen. Grassley, Chuck [R-IA]",05/24/2018,,,,11,"Senate - Judiciary",10/03/2018,"Became Public Law No: 115-253."
"S. 2896",https://www.congress.gov/bill/115th-congress/senate-bill/2896,"115th Congress (2017-2018)",,"Justice Against Corruption on K Street Act of 2018","Sen. Kennedy, John [R-LA]",05/22/2018,,,,5,"House - Judiciary | Senate - Homeland Security and Governmental Affairs",01/03/2019,"Became Public Law No: 115-418."
"S. 2850",https://www.congress.gov/bill/115th-congress/senate-bill/2850,"115th Congress (2017-2018)",,"A bill to amend the White Mountain Apache Tribe Water Rights Quantification Act of 2010 to clarify the use of amounts in the WMAT Settlement Fund.","Sen. Flake, Jeff [R-AZ]",05/15/2018,,,,1,,08/01/2018,"Became Public Law No: 115-227."
"S. 2779",https://www.congress.gov/bill/115th-congress/senate-bill/2779,"115th Congress (2017-2018)",,"Zimbabwe Democracy and Economic Recovery Amendment Act of 2018","Sen. Flake, Jeff [R-AZ]",04/26/2018,,,,1,"Senate - Foreign Relations",08/08/2018,"Became Public Law No: 115-231."
"S. 2765",https://www.congress.gov/bill/115th-congress/senate-bill/2765,"115th Congress (2017-2018)",,"RBIC Advisers Relief Act of 2018","Sen. Kennedy, John [R-LA]",04/26/2018,,,,1,"House - Financial Services | Senate - Banking, Housing, and Urban Affairs",01/03/2019,"Became Public Law No: 115-417."
"S. 2736",https://www.congress.gov/bill/115th-congress/senate-bill/2736,"115th Congress (2017-2018)",,"Asia Reassurance Initiative Act of 2018","Sen. Gardner, Cory [R-CO]",04/24/2018,,,,11,"Senate - Foreign Relations",12/31/2018,"Became Public Law No: 115-409."
"S. 2734",https://www.congress.gov/bill/115th-congress/senate-bill/2734,"115th Congress (2017-2018)",,"A bill to designate the Federal building and United States courthouse located at 1300 Victoria Street in Laredo, Texas, as the ""George P. Kazen Federal Building and United States Courthouse"".","Sen. Cornyn, John [R-TX]",04/24/2018,,,,1,"House - Transportation and Infrastructure | Senate - Environment and Public Works",07/27/2018,"Became Public Law No: 115-221."
"S. 2692",https://www.congress.gov/bill/115th-congress/senate-bill/2692,"115th Congress (2017-2018)",,"A bill to designate the facility of the United States Postal Service located at 4558 Broadway in New York, New York, as the ""Stanley Michels Post Office Building"".","Sen. Gillibrand, Kirsten E. [D-NY]",04/18/2018,,,,1,"Senate - Homeland Security and Governmental Affairs",07/30/2018,"Became Public Law No: 115-223."
"S. 2679",https://www.congress.gov/bill/115th-congress/senate-bill/2679,"115th Congress (2017-2018)",,"Veterans Small Business Enhancement Act of 2018","Sen. Duckworth, Tammy [D-IL]",04/16/2018,,,,5,"Senate - Small Business and Entrepreneurship",01/03/2019,"Became Public Law No: 115-416."
"S. 2652",https://www.congress.gov/bill/115th-congress/senate-bill/2652,"115th Congress (2017-2018)",,"Stephen Michael Gleason Congressional Gold Medal Act","Sen. Cassidy, Bill [R-LA]",04/11/2018,,,,73,"House - Financial Services | Senate - Banking, Housing, and Urban Affairs",01/03/2019,"Became Public Law No: 115-415."
"S. 2559",https://www.congress.gov/bill/115th-congress/senate-bill/2559,"115th Congress (2017-2018)",,"Marrakesh Treaty Implementation Act","Sen. Grassley, Chuck [R-IA]",03/15/2018,,,,13,"House - Judiciary | Senate - Judiciary",10/09/2018,"Became Public Law No: 115-261."
"S. 2554",https://www.congress.gov/bill/115th-congress/senate-bill/2554,"115th Congress (2017-2018)",,"Patient Right to Know Drug Prices Act","Sen. Collins, Susan M. [R-ME]",03/14/2018,,,,25,"Senate - Health, Education, Labor, and Pensions",10/10/2018,"Became Public Law No: 115-263."
"S. 2553",https://www.congress.gov/bill/115th-congress/senate-bill/2553,"115th Congress (2017-2018)",,"Know the Lowest Price Act of 2018","Sen. Stabenow, Debbie [D-MI]",03/14/2018,,,,15,"House - Energy and Commerce, Ways and Means | Senate - Finance",10/10/2018,"Became Public Law No: 115-262."
"S. 2511",https://www.congress.gov/bill/115th-congress/senate-bill/2511,"115th Congress (2017-2018)",,"CENOTE Act of 2018","Sen. Wicker, Roger F. [R-MS]",03/07/2018,,,,1,"House - Natural Resources, Science, Space, and Technology, Armed Services | Senate - Commerce, Science, and Transportation",12/21/2018,"Became Public Law No: 115-394."
"S. 2465",https://www.congress.gov/bill/115th-congress/senate-bill/2465,"115th Congress (2017-2018)",,"Sickle Cell Disease and Other Heritable Blood Disorders Research, Surveillance, Prevention, and Treatment Act of 2018","Sen. Scott, Tim [R-SC]",02/28/2018,,,,6,"Senate - Health, Education, Labor, and Pensions",12/18/2018,"Became Public Law No: 115-327."
"S. 2377",https://www.congress.gov/bill/115th-congress/senate-bill/2377,"115th Congress (2017-2018)",,"A bill to designate the Federal building and United States courthouse located at 200 West 2nd Street in Dayton, Ohio, as the ""Walter H. Rice Federal Building and United States Courthouse"".","Sen. Brown, Sherrod [D-OH]",02/06/2018,,,,1,"House - Transportation and Infrastructure | Senate - Environment and Public Works",12/13/2018,"Became Public Law No: 115-312."
"S. 2372",https://www.congress.gov/bill/115th-congress/senate-bill/2372,"115th Congress (2017-2018)",,"VA MISSION Act of 2018","Sen. Isakson, Johnny [R-GA]",02/05/2018,,,,10,"House - Veterans' Affairs, Natural Resources | Senate - Veterans' Affairs",06/06/2018,"Became Public Law No: 115-182."
"S. 2278",https://www.congress.gov/bill/115th-congress/senate-bill/2278,"115th Congress (2017-2018)",,"State Offices of Rural Health Reauthorization Act of 2018","Sen. Roberts, Pat [R-KS]",01/04/2018,,,,17,"House - Energy and Commerce | Senate - Health, Education, Labor, and Pensions",12/31/2018,"Became Public Law No: 115-408."
"S. 2276",https://www.congress.gov/bill/115th-congress/senate-bill/2276,"115th Congress (2017-2018)",,"Good Accounting Obligation in Government Act","Sen. Young, Todd C. [R-IN]",01/04/2018,,,,8,"Senate - Homeland Security and Governmental Affairs",01/03/2019,"Became Public Law No: 115-414."
"S. 2273",https://www.congress.gov/bill/115th-congress/senate-bill/2273,"115th Congress (2017-2018)",,"A bill to extend the period during which vessels that are shorter than 79 feet in length and fishing vessels are not required to have a permit for discharges incidental to the normal operation of the vessel.","Sen. Sullivan, Dan  [R-AK]",12/21/2017,,,,1,,01/03/2018,"Became Public Law No: 115-100."
