"S. 1956",https://www.congress.gov/bill/112th-congress/senate-bill/1956,"112th Congress (2011-2012)",,"European Union Emissions Trading Scheme Prohibition Act of 2011","Sen. Thune, John [R-SD]",12/07/2011,,,,12,"Senate - Commerce, Science, and Transportation",11/27/2012,"Became Public Law No: 112-200."
"S. 1710",https://www.congress.gov/bill/112th-congress/senate-bill/1710,"112th Congress (2011-2012)",,"A bill to designate the United States courthouse located at 222 West 7th Avenue, Anchorage, Alaska, as the James M. Fitzgerald United States Courthouse.","Sen. Begich, Mark [D-AK]",10/13/2011,,,,1,"House - Transportation and Infrastructure | Senate - Environment and Public Works",03/14/2012,"Became Public Law No: 112-101."
"S. 1639",https://www.congress.gov/bill/112th-congress/senate-bill/1639,"112th Congress (2011-2012)",,"A bill to amend title 36, United States Code, to authorize the American Legion under its Federal charter to provide guidance and leadership to the individual departments and posts of the American Legion, and for other purposes.","Sen. Tester, Jon [D-MT]",10/03/2011,,,,5,"House - Judiciary | Senate - Judiciary",12/13/2011,"Became Public Law No: 112-66."
"S. 1637",https://www.congress.gov/bill/112th-congress/senate-bill/1637,"112th Congress (2011-2012)",,"Appeal Time Clarification Act of 2011","Sen. Klobuchar, Amy [D-MN]",10/03/2011,,,,1,"Senate - Judiciary",11/29/2011,"Became Public Law No: 112-62."
"S. 1541",https://www.congress.gov/bill/112th-congress/senate-bill/1541,"112th Congress (2011-2012)",,"A bill to revise the Federal charter for the Blue Star Mothers of America, Inc. to reflect a change in eligibility requirements for membership.","Sen. Bennet, Michael F. [D-CO]",09/12/2011,,,,21,"Senate - Judiciary",12/13/2011,"Became Public Law No: 112-65."
"S. 1487",https://www.congress.gov/bill/112th-congress/senate-bill/1487,"112th Congress (2011-2012)",,"Asia-Pacific Economic Cooperation Business Travel Cards Act of 2011","Sen. Cantwell, Maria [D-WA]",08/02/2011,,,,2,"Senate - Homeland Security and Governmental Affairs",11/12/2011,"Became Public Law No: 112-54."
"S. 1412",https://www.congress.gov/bill/112th-congress/senate-bill/1412,"112th Congress (2011-2012)",,"A bill to designate the facility of the United States Postal Service located at 462 Washington Street, Woburn, Massachusetts, as the ""Officer John Maguire Post Office"".","Sen. Kerry, John F. [D-MA]",07/25/2011,,,,1,"House - Oversight and Government Reform | Senate - Homeland Security and Governmental Affairs",11/23/2011,"Became Public Law No: 112-60."
"S. 1379",https://www.congress.gov/bill/112th-congress/senate-bill/1379,"112th Congress (2011-2012)",,"D.C. Courts and Public Defender Service Act of 2011","Sen. Akaka, Daniel K. [D-HI]",07/18/2011,,,,0,"House - Oversight and Government Reform | Senate - Homeland Security and Governmental Affairs",12/28/2012,"Became Public Law No: 112-229."
"S. 1335",https://www.congress.gov/bill/112th-congress/senate-bill/1335,"112th Congress (2011-2012)",,"Pilot's Bill of Rights","Sen. Inhofe, James M. [R-OK]",07/06/2011,,,,65,"House - Transportation and Infrastructure | Senate - Commerce, Science, and Transportation",08/03/2012,"Became Public Law No: 112-153."
"S. 1302",https://www.congress.gov/bill/112th-congress/senate-bill/1302,"112th Congress (2011-2012)",,"A bill to authorize the Administrator of General Services to convey a parcel of real property in Tracy, California, to the City of Tracy.","Sen. Boxer, Barbara [D-CA]",06/29/2011,,,,1,"House - Oversight and Government Reform, Transportation and Infrastructure | Senate - Environment and Public Works",05/15/2012,"Became Public Law No: 112-119."
"S. 1280",https://www.congress.gov/bill/112th-congress/senate-bill/1280,"112th Congress (2011-2012)",,"Kate Puzey Peace Corps Volunteer Protection Act of 2011","Sen. Isakson, Johnny [R-GA]",06/27/2011,,,,30,"House - Foreign Affairs | Senate - Foreign Relations",11/21/2011,"Became Public Law No: 112-57."
"S. 1134",https://www.congress.gov/bill/112th-congress/senate-bill/1134,"112th Congress (2011-2012)",,"St. Croix River Crossing Project Authorization Act","Sen. Klobuchar, Amy [D-MN]",05/26/2011,,,,3,"House - Transportation and Infrastructure, Natural Resources, Budget | Senate - Energy and Natural Resources",03/14/2012,"Became Public Law No: 112-100."
"S. 1103",https://www.congress.gov/bill/112th-congress/senate-bill/1103,"112th Congress (2011-2012)",,"A bill to extend the term of the incumbent Director of the Federal Bureau of Investigation.","Sen. Leahy, Patrick J. [D-VT]",05/26/2011,,,,3,"House - Judiciary | Senate - Judiciary",07/26/2011,"Became Public Law No: 112-24."
"S. 1082",https://www.congress.gov/bill/112th-congress/senate-bill/1082,"112th Congress (2011-2012)",,"Small Business Additional Temporary Extension Act of 2011","Sen. Landrieu, Mary L. [D-LA]",05/26/2011,,,,0,,06/01/2011,"Became Public Law No: 112-17."
"S. 997",https://www.congress.gov/bill/112th-congress/senate-bill/997,"112th Congress (2011-2012)",,"East Bench Irrigation District Water Contract Extension Act","Sen. Tester, Jon [D-MT]",05/12/2011,,,,0,"House - Natural Resources | Senate - Energy and Natural Resources",06/27/2012,"Became Public Law No: 112-139."
"S. 990",https://www.congress.gov/bill/112th-congress/senate-bill/990,"112th Congress (2011-2012)",,"PATRIOT Sunsets Extension Act of 2011","Sen. Landrieu, Mary L. [D-LA]",05/12/2011,,,,0,,05/26/2011,"Became Public Law No: 112-14."
"S. 925",https://www.congress.gov/bill/112th-congress/senate-bill/925,"112th Congress (2011-2012)",,"Mt. Andrea Lawrence Designation Act of 2011","Sen. Boxer, Barbara [D-CA]",05/09/2011,,,,0,"House - Natural Resources | Senate - Energy and Natural Resources",01/10/2013,"Became Public Law No: 112-259."
"S. 894",https://www.congress.gov/bill/112th-congress/senate-bill/894,"112th Congress (2011-2012)",,"Veterans' Compensation Cost-of-Living Adjustment Act of 2011","Sen. Murray, Patty [D-WA]",05/05/2011,,,,14,"Senate - Veterans' Affairs",11/09/2011,"Became Public Law No: 112-53."
"S. 846",https://www.congress.gov/bill/112th-congress/senate-bill/846,"112th Congress (2011-2012)",,"A bill to designate the United States courthouse located at 80 Lafayette Street in Jefferson City, Missouri, as the Christopher S. Bond United States Courthouse.","Sen. Blunt, Roy [R-MO]",04/14/2011,,,,1,"House - Transportation and Infrastructure | Senate - Environment and Public Works",09/23/2011,"Became Public Law No: 112-31."
"S. 743",https://www.congress.gov/bill/112th-congress/senate-bill/743,"112th Congress (2011-2012)",,"Whistleblower Protection Enhancement Act of 2012","Sen. Akaka, Daniel K. [D-HI]",04/06/2011,,,,14,"House - Oversight and Government Reform, Intelligence (Permanent), Homeland Security | Senate - Homeland Security and Governmental Affairs",11/27/2012,"Became Public Law No: 112-199."
"S. 739",https://www.congress.gov/bill/112th-congress/senate-bill/739,"112th Congress (2011-2012)",,"A bill to authorize the Architect of the Capitol to establish battery recharging stations for privately owned vehicles in parking areas under the jurisdiction of the Senate at no net cost to the Federal Government.","Sen. Levin, Carl [D-MI]",04/06/2011,,,,7,"Senate - Rules and Administration",08/10/2012,"Became Public Law No: 112-167."
"S. 710",https://www.congress.gov/bill/112th-congress/senate-bill/710,"112th Congress (2011-2012)",,"Hazardous Waste Electronic Manifest Establishment Act","Sen. Thune, John [R-SD]",03/31/2011,,,,5,"House - Energy and Commerce | Senate - Environment and Public Works",10/05/2012,"Became Public Law No: 112-195."
"S. 684",https://www.congress.gov/bill/112th-congress/senate-bill/684,"112th Congress (2011-2012)",,"A bill to provide for the conveyance of certain parcels of land to the town of Alta, Utah.","Sen. Lee, Mike [R-UT]",03/30/2011,,,,0,"House - Natural Resources | Senate - Energy and Natural Resources",06/27/2012,"Became Public Law No: 112-138."
"S. 683",https://www.congress.gov/bill/112th-congress/senate-bill/683,"112th Congress (2011-2012)",,"Box Elder Utah Land Conveyance Act","Sen. Lee, Mike [R-UT]",03/30/2011,,,,0,"Senate - Energy and Natural Resources",12/19/2011,"Became Public Law No: 112-70."
"S. 679",https://www.congress.gov/bill/112th-congress/senate-bill/679,"112th Congress (2011-2012)",,"Presidential Appointment Efficiency and Streamlining Act of 2011","Sen. Schumer, Charles E. [D-NY]",03/30/2011,,,,17,"Senate - Homeland Security and Governmental Affairs",08/10/2012,"Became Public Law No: 112-166."
"S. 655",https://www.congress.gov/bill/112th-congress/senate-bill/655,"112th Congress (2011-2012)",,"A bill to designate the facility of the United States Postal Service located at 95 Dogwood Street in Cary, Mississippi, as the ""Spencer Byrd Powers, Jr. Post Office"".","Sen. Cochran, Thad [R-MS]",03/28/2011,,,,0,"House - Oversight and Government Reform | Senate - Homeland Security and Governmental Affairs",06/29/2011,"Became Public Law No: 112-23."
"S. 535",https://www.congress.gov/bill/112th-congress/senate-bill/535,"112th Congress (2011-2012)",,"Fort Pulaski National Monument Lease Authorization Act","Sen. Isakson, Johnny [R-GA]",03/09/2011,,,,1,"House - Natural Resources | Senate - Energy and Natural Resources",12/19/2011,"Became Public Law No: 112-69."
"S. 404",https://www.congress.gov/bill/112th-congress/senate-bill/404,"112th Congress (2011-2012)",,"A bill to modify a land grant patent issued by the Secretary of the Interior.","Sen. Levin, Carl [D-MI]",02/17/2011,,,,0,"House - Natural Resources | Senate - Energy and Natural Resources",06/27/2012,"Became Public Law No: 112-137."
"S. 384",https://www.congress.gov/bill/112th-congress/senate-bill/384,"112th Congress (2011-2012)",,"A bill to amend title 39, United States Code, to extend the authority of the United States Postal Service to issue a semipostal to raise funds for breast cancer research.","Sen. Feinstein, Dianne [D-CA]",02/17/2011,,,,66,"Senate - Homeland Security and Governmental Affairs",12/23/2011,"Became Public Law No: 112-80."
"S. 365",https://www.congress.gov/bill/112th-congress/senate-bill/365,"112th Congress (2011-2012)",,"Budget Control Act of 2011","Sen. Harkin, Tom [D-IA]",02/16/2011,,,,0,"House - Education and the Workforce | Senate - Health, Education, Labor, and Pensions",08/02/2011,"Became Public Law No: 112-25."
"S. 363",https://www.congress.gov/bill/112th-congress/senate-bill/363,"112th Congress (2011-2012)",,"A bill to authorize the Secretary of Commerce to convey property of the National Oceanic and Atmospheric Administration to the City of Pascagoula, Mississippi, and for other purposes.","Sen. Wicker, Roger F. [R-MS]",02/16/2011,,,,1,"House - Natural Resources | Senate - Commerce, Science, and Transportation",06/15/2012,"Became Public Law No: 112-134."
"S. 349",https://www.congress.gov/bill/112th-congress/senate-bill/349,"112th Congress (2011-2012)",,"A bill to designate the facility of the United States Postal Service located at 4865 Tallmadge Road in Rootstown, Ohio, as the ""Marine Sgt. Jeremy E. Murray Post Office"".","Sen. Brown, Sherrod [D-OH]",02/15/2011,,,,1,"House - Oversight and Government Reform | Senate - Homeland Security and Governmental Affairs",06/29/2011,"Became Public Law No: 112-22."
"S. 307",https://www.congress.gov/bill/112th-congress/senate-bill/307,"112th Congress (2011-2012)",,"A bill to designate the Federal building and United States courthouse located at 217 West King Street, Martinsburg, West Virginia, as the ""W. Craig Broadwater Federal Building and United States Courthouse"".","Sen. Rockefeller, John D., IV [D-WV]",02/08/2011,,,,0,"House - Transportation and Infrastructure | Senate - Environment and Public Works",04/25/2011,"Became Public Law No: 112-11."
"S. 300",https://www.congress.gov/bill/112th-congress/senate-bill/300,"112th Congress (2011-2012)",,"Government Charge Card Abuse Prevention Act of 2012","Sen. Grassley, Chuck [R-IA]",02/08/2011,,,,4,"House - Oversight and Government Reform, Armed Services | Senate - Homeland Security and Governmental Affairs",10/05/2012,"Became Public Law No: 112-194."
"S. 292",https://www.congress.gov/bill/112th-congress/senate-bill/292,"112th Congress (2011-2012)",,"Salmon Lake Land Selection Resolution Act","Sen. Murkowski, Lisa [R-AK]",02/04/2011,,,,1,"House - Natural Resources | Senate - Energy and Natural Resources",06/15/2012,"Became Public Law No: 112-133."
"S. 285",https://www.congress.gov/bill/112th-congress/senate-bill/285,"112th Congress (2011-2012)",,"A bill for the relief of Sopuruchi Chukwueke.","Sen. Levin, Carl [D-MI]",02/03/2011,,,,0,"House - Judiciary | Senate - Judiciary",12/28/2012,"Became Private Law No: 112-1."
"S. 278",https://www.congress.gov/bill/112th-congress/senate-bill/278,"112th Congress (2011-2012)",,"Sugar Loaf Fire Protection District Land Exchange Act of 2011","Sen. Udall, Mark [D-CO]",02/03/2011,,,,1,"Senate - Energy and Natural Resources",12/23/2011,"Became Public Law No: 112-79."
"S. 271",https://www.congress.gov/bill/112th-congress/senate-bill/271,"112th Congress (2011-2012)",,"Wallowa Forest Service Compound Conveyance Act","Sen. Wyden, Ron [D-OR]",02/03/2011,,,,1,"House - Natural Resources | Senate - Energy and Natural Resources",08/10/2012,"Became Public Law No: 112-165."
"S. 270",https://www.congress.gov/bill/112th-congress/senate-bill/270,"112th Congress (2011-2012)",,"La Pine Land Conveyance Act","Sen. Wyden, Ron [D-OR]",02/03/2011,,,,1,"House - Natural Resources | Senate - Energy and Natural Resources",08/10/2012,"Became Public Law No: 112-164."
"S. 188",https://www.congress.gov/bill/112th-congress/senate-bill/188,"112th Congress (2011-2012)",,"A bill to designate the United States courthouse under construction at 98 West First Street, Yuma, Arizona, as the ""John M. Roll United States Courthouse"".","Sen. McCain, John [R-AZ]",01/26/2011,,,,1,"Senate - Environment and Public Works",02/17/2011,"Became Public Law No: 112-2."
"S.J.Res. 49",https://www.congress.gov/bill/112th-congress/senate-joint-resolution/49,"112th Congress (2011-2012)",,"A joint resolution providing for the appointment of Barbara Barrett as a citizen regent of the Board of Regents of the Smithsonian Institution.","Sen. Leahy, Patrick J. [D-VT]",08/01/2012,,,,2,"House - House Administration",01/10/2013,"Became Public Law No: 112-262."
"S.J.Res. 44",https://www.congress.gov/bill/112th-congress/senate-joint-resolution/44,"112th Congress (2011-2012)",,"A joint resolution granting the consent of Congress to the State and Province Emergency Management Assistance Memorandum of Understanding.","Sen. Kohl, Herb [D-WI]",06/14/2012,,,,4,"House - Foreign Affairs | Senate - Judiciary",01/14/2013,"Became Public Law No: 112-282."
"S.J.Res. 22",https://www.congress.gov/bill/112th-congress/senate-joint-resolution/22,"112th Congress (2011-2012)",,"A joint resolution to grant the consent of Congress to an amendment to the compact between the States of Missouri and Illinois providing that bonds issued by the Bi-State Development Agency may mature in not to exceed 40 years.","Sen. McCaskill, Claire [D-MO]",06/28/2011,,,,3,"Senate - Judiciary",12/19/2011,"Became Public Law No: 112-71."
"S.J.Res. 9",https://www.congress.gov/bill/112th-congress/senate-joint-resolution/9,"112th Congress (2011-2012)",,"A joint resolution providing for the reappointment of Robert P. Kogod as a citizen regent of the Board of Regents of the Smithsonian Institution.","Sen. Leahy, Patrick J. [D-VT]",02/28/2011,,,,2,"House - House Administration | Senate - Rules and Administration",06/24/2011,"Became Public Law No: 112-20."
"S.J.Res. 8",https://www.congress.gov/bill/112th-congress/senate-joint-resolution/8,"112th Congress (2011-2012)",,"A joint resolution providing for the appointment of Stephen M. Case as a citizen regent of the Board of Regents of the Smithsonian Institution.","Sen. Leahy, Patrick J. [D-VT]",02/28/2011,,,,2,"House - House Administration | Senate - Rules and Administration",04/25/2011,"Became Public Law No: 112-12."
"S.J.Res. 7",https://www.congress.gov/bill/112th-congress/senate-joint-resolution/7,"112th Congress (2011-2012)",,"A joint resolution providing for the reappointment of Shirley Ann Jackson as a citizen regent of the Board of Regents of the Smithsonian Institution.","Sen. Leahy, Patrick J. [D-VT]",02/28/2011,,,,2,"House - House Administration | Senate - Rules and Administration",06/24/2011,"Became Public Law No: 112-19."
"S. 4058",https://www.congress.gov/bill/111th-congress/senate-bill/4058,"111th Congress (2009-2010)",,"Helping Heroes Keep Their Homes Act of 2010","Sen. Kerry, John F. [D-MA]",12/22/2010,,,,0,,12/29/2010,"Became Public Law No: 111-346."
"S. 4036",https://www.congress.gov/bill/111th-congress/senate-bill/4036,"111th Congress (2009-2010)",,"A bill to clarify the National Credit Union Administration authority to make stabilization fund expenditures without borrowing from the Treasury.","Sen. Dodd, Christopher J. [D-CT]",12/16/2010,,,,0,"House - Financial Services",01/04/2011,"Became Public Law No: 111-382."
"S. 4010",https://www.congress.gov/bill/111th-congress/senate-bill/4010,"111th Congress (2009-2010)",,"A bill for the relief of Shigeru Yamada.","Sen. Feinstein, Dianne [D-CA]",12/06/2010,,,,0,,12/22/2010,"Became Private Law No: 111-1."
"S. 4005",https://www.congress.gov/bill/111th-congress/senate-bill/4005,"111th Congress (2009-2010)",,"Preserving Foreign Criminal Assets for Forfeiture Act of 2010","Sen. Whitehouse, Sheldon [D-RI]",12/02/2010,,,,1,"House - Judiciary | Senate - Judiciary",12/22/2010,"Became Public Law No: 111-342."
"S. 3998",https://www.congress.gov/bill/111th-congress/senate-bill/3998,"111th Congress (2009-2010)",,"Criminal History Background Checks Pilot Extension Act of 2010","Sen. Schumer, Charles E. [D-NY]",12/01/2010,,,,1,"House - Judiciary",12/22/2010,"Became Public Law No: 111-341."
"S. 3987",https://www.congress.gov/bill/111th-congress/senate-bill/3987,"111th Congress (2009-2010)",,"Red Flag Program Clarification Act of 2010","Sen. Thune, John [R-SD]",11/30/2010,,,,1,"House - Financial Services",12/18/2010,"Became Public Law No: 111-319."
"S. 3984",https://www.congress.gov/bill/111th-congress/senate-bill/3984,"111th Congress (2009-2010)",,"Museum and Library Services Act of 2010","Sen. Reed, Jack [D-RI]",11/29/2010,,,,6,"House - Education and Labor | Senate - Health, Education, Labor, and Pensions",12/22/2010,"Became Public Law No: 111-340."
"S. 3903",https://www.congress.gov/bill/111th-congress/senate-bill/3903,"111th Congress (2009-2010)",,"A bill to authorize leases of up to 99 years for lands held in trust for Ohkay Owingeh Pueblo.","Sen. Udall, Tom [D-NM]",09/29/2010,,,,1,"Senate - Indian Affairs",01/04/2011,"Became Public Law No: 111-381."
"S. 3874",https://www.congress.gov/bill/111th-congress/senate-bill/3874,"111th Congress (2009-2010)",,"Reduction of Lead in Drinking Water Act","Sen. Boxer, Barbara [D-CA]",09/29/2010,,,,10,"Senate - Environment and Public Works",01/04/2011,"Became Public Law No: 111-380."
"S. 3860",https://www.congress.gov/bill/111th-congress/senate-bill/3860,"111th Congress (2009-2010)",,"A bill to require reports on the management of Arlington National Cemetery.","Sen. McCaskill, Claire [D-MO]",09/28/2010,,,,12,"House - Veterans' Affairs | Senate - Veterans' Affairs",12/22/2010,"Became Public Law No: 111-339."
"S. 3847",https://www.congress.gov/bill/111th-congress/senate-bill/3847,"111th Congress (2009-2010)",,"Security Cooperation Act of 2010","Sen. Kerry, John F. [D-MA]",09/27/2010,,,,1,,10/08/2010,"Became Public Law No: 111-266."
"S. 3839",https://www.congress.gov/bill/111th-congress/senate-bill/3839,"111th Congress (2009-2010)",,"A bill to provide for an additional temporary extension of programs under the Small Business Act and the Small Business Investment Act of 1958, and for other purposes.","Sen. Landrieu, Mary L. [D-LA]",09/24/2010,,,,1,"House - Small Business",09/30/2010,"Became Public Law No: 111-251."
"S. 3828",https://www.congress.gov/bill/111th-congress/senate-bill/3828,"111th Congress (2009-2010)",,"A bill to make technical corrections in the Twenty-First Century Communications and Video Accessibility Act of 2010 and the amendments made by that Act.","Sen. Pryor, Mark L. [D-AR]",09/22/2010,,,,0,"House - Energy and Commerce",10/08/2010,"Became Public Law No: 111-265."
"S. 3817",https://www.congress.gov/bill/111th-congress/senate-bill/3817,"111th Congress (2009-2010)",,"CAPTA Reauthorization Act of 2010","Sen. Dodd, Christopher J. [D-CT]",09/22/2010,,,,4,"House - Education and Labor | Senate - Health, Education, Labor, and Pensions",12/20/2010,"Became Public Law No: 111-320."
"S. 3814",https://www.congress.gov/bill/111th-congress/senate-bill/3814,"111th Congress (2009-2010)",,"National Flood Insurance Program Reextension Act of 2010","Sen. Vitter, David [R-LA]",09/21/2010,,,,6,,09/30/2010,"Became Public Law No: 111-250."
"S. 3802",https://www.congress.gov/bill/111th-congress/senate-bill/3802,"111th Congress (2009-2010)",,"Mount Stevens and Ted Stevens Icefield Designation Act","Sen. Murkowski, Lisa [R-AK]",09/20/2010,,,,1,"House - Natural Resources | Senate - Energy and Natural Resources",10/18/2010,"Became Public Law No: 111-284."
"S. 3794",https://www.congress.gov/bill/111th-congress/senate-bill/3794,"111th Congress (2009-2010)",,"Formerly Owned Resources for Veterans to Express Thanks for Service Act of 2010","Sen. Leahy, Patrick J. [D-VT]",09/16/2010,,,,2,"House - Oversight and Government Reform | Senate - Homeland Security and Governmental Affairs",12/22/2010,"Became Public Law No: 111-338."
"S. 3789",https://www.congress.gov/bill/111th-congress/senate-bill/3789,"111th Congress (2009-2010)",,"Social Security Number Protection Act of 2010","Sen. Feinstein, Dianne [D-CA]",09/15/2010,,,,5,"Senate - Finance",12/18/2010,"Became Public Law No: 111-318."
"S. 3774",https://www.congress.gov/bill/111th-congress/senate-bill/3774,"111th Congress (2009-2010)",,"A bill to extend the deadline for Social Services Block Grant expenditures of supplemental funds appropriated following disasters occurring in 2008.","Sen. Cornyn, John [R-TX]",09/14/2010,,,,6,"Senate - Finance",11/24/2010,"Became Public Law No: 111-285."
"S. 3751",https://www.congress.gov/bill/111th-congress/senate-bill/3751,"111th Congress (2009-2010)",,"Stem Cell Therapeutic and Research Reauthorization Act of 2010","Sen. Hatch, Orrin G. [R-UT]",08/05/2010,,,,12,"Senate - Health, Education, Labor, and Pensions",10/08/2010,"Became Public Law No: 111-264."
"S. 3729",https://www.congress.gov/bill/111th-congress/senate-bill/3729,"111th Congress (2009-2010)",,"National Aeronautics and Space Administration Authorization Act of 2010","Sen. Rockefeller, John D., IV [D-WV]",08/05/2010,,,,0,"Senate - Commerce, Science, and Transportation",10/11/2010,"Became Public Law No: 111-267."
"S. 3717",https://www.congress.gov/bill/111th-congress/senate-bill/3717,"111th Congress (2009-2010)",,"A bill to amend the Securities Exchange Act of 1934, the Investment Company Act of 1940, and the Investment Advisers Act of 1940 to provide for certain disclosures under section 552 of title 5, United States Code, (commonly referred to as the Freedom of Information Act), and for other purposes.","Sen. Leahy, Patrick J. [D-VT]",08/05/2010,,,,3,"Senate - Judiciary",10/05/2010,"Became Public Law No: 111-257."
"S. 3689",https://www.congress.gov/bill/111th-congress/senate-bill/3689,"111th Congress (2009-2010)",,"Copyright Cleanup, Clarification, and Corrections Act of 2010","Sen. Leahy, Patrick J. [D-VT]",08/02/2010,,,,1,"House - Judiciary, Budget",12/09/2010,"Became Public Law No: 111-295."
"S. 3656",https://www.congress.gov/bill/111th-congress/senate-bill/3656,"111th Congress (2009-2010)",,"Mandatory Price Reporting Act of 2010","Sen. Lincoln, Blanche L. [D-AR]",07/27/2010,,,,19,"House - Agriculture | Senate - Agriculture, Nutrition, and Forestry",09/27/2010,"Became Public Law No: 111-239."
"S. 3592",https://www.congress.gov/bill/111th-congress/senate-bill/3592,"111th Congress (2009-2010)",,"A bill to designate the facility of the United States Postal Service located at 100 Commerce Drive in Tyrone, Georgia, as the ""First Lieutenant Robert Wilson Collins Post Office Building"".","Sen. Chambliss, Saxby [R-GA]",07/15/2010,,,,1,"Senate - Homeland Security and Governmental Affairs",01/04/2011,"Became Public Law No: 111-379."
"S. 3567",https://www.congress.gov/bill/111th-congress/senate-bill/3567,"111th Congress (2009-2010)",,"A bill to designate the facility of the United States Postal Service located at 100 Broadway in Lynbrook, New York, as the ""Navy Corpsman Jeffrey L. Wiener Post Office Building"".","Sen. Schumer, Charles E. [D-NY]",07/12/2010,,,,1,"House - Oversight and Government Reform | Senate - Homeland Security and Governmental Affairs",11/30/2010,"Became Public Law No: 111-288."
"S. 3481",https://www.congress.gov/bill/111th-congress/senate-bill/3481,"111th Congress (2009-2010)",,"A bill to amend the Federal Water Pollution Control Act to clarify Federal responsibility for stormwater pollution.","Sen. Cardin, Benjamin L. [D-MD]",06/10/2010,,,,3,"Senate - Environment and Public Works",01/04/2011,"Became Public Law No: 111-378."
"S. 3473",https://www.congress.gov/bill/111th-congress/senate-bill/3473,"111th Congress (2009-2010)",,"A bill to amend the Oil Pollution Act of 1990 to authorize advances from Oil Spill Liability Trust Fund for the Deepwater Horizon oil spill.","Sen. Reid, Harry [D-NV]",06/09/2010,,,,0,,06/15/2010,"Became Public Law No: 111-191."
"S. 3447",https://www.congress.gov/bill/111th-congress/senate-bill/3447,"111th Congress (2009-2010)",,"Post-9/11 Veterans Educational Assistance Improvements Act of 2010","Sen. Akaka, Daniel K. [D-HI]",05/27/2010,,,,35,"House - Veterans' Affairs, Armed Services, Budget | Senate - Veterans' Affairs",01/04/2011,"Became Public Law No: 111-377."
