"Downloaded on",02/17/2020,"11:59:34 EST"
"Search URL",https://www.congress.gov/search?s=2&searchResultViewType=expanded&KWICView=false&q=%7B%22source%22%3A%5B%22legislation%22%5D%2C%22chamber%22%3A%22Senate%22%2C%22congress%22%3A%5B%22108%22%2C%22107%22%2C%22106%22%2C%22105%22%2C%22104%22%2C%22103%22%5D%2C%22bill-status%22%3A%5B%22law%22%5D%7D

"Legislation Number",URL,Congress,"Amends Bill",Title,Sponsor,"Date of Introduction","Date Offered","Date Submitted","Date Proposed","Number of Cosponsors",Committees,"Latest Action Date","Latest Action"
"S. 3014",https://www.congress.gov/bill/108th-congress/senate-bill/3014,"108th Congress (2003-2004)",,"Harmful Algal Bloom and Hypoxia Amendments Act of 2004","Sen. Snowe, Olympia J. [R-ME]",11/19/2004,,,,4,,12/10/2004,"Became Public Law No: 108-456."
"S. 2986",https://www.congress.gov/bill/108th-congress/senate-bill/2986,"108th Congress (2003-2004)",,"A bill to amend title 31 of the United States Code to increase the public debt limit.","Sen. Frist, William H. [R-TN]",11/16/2004,,,,0,,11/19/2004,"Became Public Law No: 108-415."
"S. 2965",https://www.congress.gov/bill/108th-congress/senate-bill/2965,"108th Congress (2003-2004)",,"A bill to amend the Livestock Mandatory Price Reporting Act of 1999 to modify the termination date for mandatory price reporting.","Sen. Cochran, Thad [R-MS]",10/08/2004,,,,1,"House - Agriculture",12/03/2004,"Became Public Law No: 108-444."
"S. 2896",https://www.congress.gov/bill/108th-congress/senate-bill/2896,"108th Congress (2003-2004)",,"A bill to modify and extend certain privatization requirements of the Communications Satellite Act of 1962.","Sen. Burns, Conrad R. [R-MT]",10/05/2004,,,,1,,10/25/2004,"Became Public Law No: 108-371."
"S. 2895",https://www.congress.gov/bill/108th-congress/senate-bill/2895,"108th Congress (2003-2004)",,"A bill to authorize the Gateway Arch in St. Louis, Missouri, to be illuminated by pink lights in honor of breast cancer awareness month.","Sen. Talent, Jim [R-MO]",10/05/2004,,,,1,,10/20/2004,"Became Public Law No: 108-348."
"S. 2883",https://www.congress.gov/bill/108th-congress/senate-bill/2883,"108th Congress (2003-2004)",,"Prevention of Child Abduction Partnership Act","Sen. Hatch, Orrin G. [R-UT]",10/01/2004,,,,1,,10/25/2004,"Became Public Law No: 108-370."
"S. 2873",https://www.congress.gov/bill/108th-congress/senate-bill/2873,"108th Congress (2003-2004)",,"A bill to extend the authority of the United States District Court for the Southern District of Iowa to hold court in Rock Island, Illinois.","Sen. Grassley, Chuck [R-IA]",09/30/2004,,,,5,"Senate - Judiciary",12/10/2004,"Became Public Law No: 108-455."
"S. 2864",https://www.congress.gov/bill/108th-congress/senate-bill/2864,"108th Congress (2003-2004)",,"Family Farmer Bankruptcy Relief Act of 2004","Sen. Grassley, Chuck [R-IA]",09/29/2004,,,,5,"House - Judiciary | Senate - Judiciary",10/25/2004,"Became Public Law No: 108-369."
"S. 2856",https://www.congress.gov/bill/108th-congress/senate-bill/2856,"108th Congress (2003-2004)",,"A bill to limit the transfer of certain Commodity Credit Coporation funds between conservation programs for technical assistance for the programs.","Sen. Cochran, Thad [R-MS]",09/28/2004,,,,2,"House - Agriculture | Senate - Agriculture, Nutrition, and Forestry",12/23/2004,"Became Public Law No: 108-498."
"S. 2845",https://www.congress.gov/bill/108th-congress/senate-bill/2845,"108th Congress (2003-2004)",,"Intelligence Reform and Terrorism Prevention Act of 2004","Sen. Collins, Susan M. [R-ME]",09/23/2004,,,,10,,12/17/2004,"Became Public Law No: 108-458."
"S. 2781",https://www.congress.gov/bill/108th-congress/senate-bill/2781,"108th Congress (2003-2004)",,"Comprehensive Peace in Sudan Act of 2004","Sen. Lugar, Richard G. [R-IN]",09/09/2004,,,,18,"House - International Relations | Senate - Foreign Relations",12/23/2004,"Became Public Law No: 108-497."
"S. 2742",https://www.congress.gov/bill/108th-congress/senate-bill/2742,"108th Congress (2003-2004)",,"A bill to extend certain authority of the Supreme Court Police, modify the venue of prosecutions relating to the Supreme Court building and grounds, and authorize the acceptance of gifts to the United States Supreme Court.","Sen. Hatch, Orrin G. [R-UT]",07/22/2004,,,,1,"House - Judiciary | Senate - Judiciary",10/21/2004,"Became Public Law No: 108-356."
"S. 2712",https://www.congress.gov/bill/108th-congress/senate-bill/2712,"108th Congress (2003-2004)",,"A bill to preserve the ability of the Federal Housing Administration to insure mortgages under sections 238 and 519 of the National Housing Act.","Sen. Reed, Jack [D-RI]",07/21/2004,,,,4,"Senate - Banking, Housing, and Urban Affairs",08/09/2004,"Became Public Law No: 108-301."
"S. 2693",https://www.congress.gov/bill/108th-congress/senate-bill/2693,"108th Congress (2003-2004)",,"A bill to designate the facility of the United States Postal Service located at 1475 Western Avenue, Suite 45, in Albany, New York, as the ""Lieutenant John F. Finn Post Office"".","Sen. Schumer, Charles E. [D-NY]",07/20/2004,,,,1,"House - Government Reform | Senate - Governmental Affairs",12/03/2004,"Became Public Law No: 108-443."
"S. 2657",https://www.congress.gov/bill/108th-congress/senate-bill/2657,"108th Congress (2003-2004)",,"Federal Employee Dental and Vision Benefits Enhancement Act of 2004","Sen. Collins, Susan M. [R-ME]",07/14/2004,,,,5,"Senate - Governmental Affairs",12/23/2004,"Became Public Law No: 108-496."
"S. 2640",https://www.congress.gov/bill/108th-congress/senate-bill/2640,"108th Congress (2003-2004)",,"A bill to designate the facility of the United States Postal Service located at 1050 North Hills Boulevard in Reno, Nevada, as the ""Guardians of Freedom Memorial Post Office Building"" and to authorize the installation of a plaque at such site, and for other purposes.","Sen. Ensign, John [R-NV]",07/13/2004,,,,1,"Senate - Governmental Affairs",12/03/2004,"Became Public Law No: 108-442."
"S. 2634",https://www.congress.gov/bill/108th-congress/senate-bill/2634,"108th Congress (2003-2004)",,"Garrett Lee Smith Memorial Act","Sen. Dodd, Christopher J. [D-CT]",07/08/2004,,,,39,"House - Energy and Commerce",10/21/2004,"Became Public Law No: 108-355."
"S. 2618",https://www.congress.gov/bill/108th-congress/senate-bill/2618,"108th Congress (2003-2004)",,"A bill to amend title XIX of the Social Security Act to extend medicare cost-sharing for the medicare part B premium for qualifying individuals through September 2005.","Sen. Grassley, Chuck [R-IA]",07/07/2004,,,,4,"House - Energy and Commerce | Senate - Finance",12/08/2004,"Became Public Law No: 108-448."
"S. 2511",https://www.congress.gov/bill/108th-congress/senate-bill/2511,"108th Congress (2003-2004)",,"Chimayo Water Supply System and Espanola Filtration Facility Act of 2004","Sen. Domenici, Pete V. [R-NM]",06/08/2004,,,,1,"House - Resources | Senate - Energy and Natural Resources",10/21/2004,"Became Public Law No: 108-354."
"S. 2508",https://www.congress.gov/bill/108th-congress/senate-bill/2508,"108th Congress (2003-2004)",,"A bill to redesignate the Ridges Basin Reservoir, Colorado, as Lake Nighthorse.","Sen. Domenici, Pete V. [R-NM]",06/07/2004,,,,1,"House - Resources | Senate - Energy and Natural Resources",10/18/2004,"Became Public Law No: 108-345."
"S. 2507",https://www.congress.gov/bill/108th-congress/senate-bill/2507,"108th Congress (2003-2004)",,"Child Nutrition and WIC Reauthorization Act of 2004 
","Sen. Cochran, Thad [R-MS]",06/07/2004,,,,0,"Senate - Agriculture, Nutrition, and Forestry",06/30/2004,"Became Public Law No: 108-265."
"S. 2486",https://www.congress.gov/bill/108th-congress/senate-bill/2486,"108th Congress (2003-2004)",,"Veterans Benefits Improvement Act of 2004","Sen. Specter, Arlen [R-PA]",06/01/2004,,,,2,"House - Veterans' Affairs | Senate - Veterans' Affairs",12/10/2004,"Became Public Law No: 108-454."
"S. 2484",https://www.congress.gov/bill/108th-congress/senate-bill/2484,"108th Congress (2003-2004)",,"Department of Veterans Affairs Health Care Personnel Enhancement Act of 2004","Sen. Specter, Arlen [R-PA]",06/01/2004,,,,0,"Senate - Veterans' Affairs",12/03/2004,"Became Public Law No: 108-445."
"S. 2415",https://www.congress.gov/bill/108th-congress/senate-bill/2415,"108th Congress (2003-2004)",,"A bill to designate the facility of the United States Postal Service located at 4141 Postmark Drive, Anchorage, Alaska, as the 'Robert J. Opinsky Post Office Building'.","Sen. Stevens, Ted [R-AK]",05/13/2004,,,,1,"House - Government Reform | Senate - Governmental Affairs",10/21/2004,"Became Public Law No: 108-353."
"S. 2363",https://www.congress.gov/bill/108th-congress/senate-bill/2363,"108th Congress (2003-2004)",,"A bill to revise and extend the Boys and Girls Clubs of America.","Sen. Hatch, Orrin G. [R-UT]",04/29/2004,,,,48,"House - Judiciary | Senate - Judiciary",10/18/2004,"Became Public Law No: 108-344."
"S. 2319",https://www.congress.gov/bill/108th-congress/senate-bill/2319,"108th Congress (2003-2004)",,"Tapoco Project Licensing Act of 2004","Sen. Alexander, Lamar [R-TN]",04/19/2004,,,,0,"Senate - Energy and Natural Resources",10/18/2004,"Became Public Law No: 108-343."
"S. 2315",https://www.congress.gov/bill/108th-congress/senate-bill/2315,"108th Congress (2003-2004)",,"A bill to amend the Communications Satellite Act of 1962 to extend the deadline for the INTELSAT initial public offering.","Sen. Burns, Conrad R. [R-MT]",04/08/2004,,,,0,"House - Energy and Commerce | Senate - Commerce, Science, and Transportation",05/18/2004,"Became Public Law No: 108-228."
"S. 2302",https://www.congress.gov/bill/108th-congress/senate-bill/2302,"108th Congress (2003-2004)",,"A bill to improve access to physicians in medically underserved areas.","Sen. Conrad, Kent [D-ND]",04/07/2004,,,,15,"Senate - Judiciary",12/03/2004,"Became Public Law No: 108-441."
"S. 2292",https://www.congress.gov/bill/108th-congress/senate-bill/2292,"108th Congress (2003-2004)",,"Global Anti-Semitism Review Act of 2004","Sen. Voinovich, George V. [R-OH]",04/07/2004,,,,24,"House - International Relations | Senate - Foreign Relations",10/16/2004,"Became Public Law No: 108-332."
"S. 2264",https://www.congress.gov/bill/108th-congress/senate-bill/2264,"108th Congress (2003-2004)",,"Northern Uganda Crisis Response Act","Sen. Feingold, Russell D. [D-WI]",03/31/2004,,,,8,"House - International Relations | Senate - Foreign Relations",08/02/2004,"Became Public Law No: 108-283."
"S. 2241",https://www.congress.gov/bill/108th-congress/senate-bill/2241,"108th Congress (2003-2004)",,"A bill to reauthorize certain school lunch and child nutrition programs through June 30, 2004.","Sen. Cochran, Thad [R-MS]",03/26/2004,,,,1,,03/31/2004,"Became Public Law No: 108-211."
"S. 2238",https://www.congress.gov/bill/108th-congress/senate-bill/2238,"108th Congress (2003-2004)",,"Bunning-Bereuter-Blumenaur Flood Insurance Reform Act of 2004","Sen. Bunning, Jim [R-KY]",03/25/2004,,,,9,"Senate - Banking, Housing, and Urban Affairs",06/30/2004,"Became Public Law No: 108-264."
"S. 2231",https://www.congress.gov/bill/108th-congress/senate-bill/2231,"108th Congress (2003-2004)",,"Welfare Reform Extension Act of 2004","Sen. Grassley, Chuck [R-IA]",03/25/2004,,,,1,"House - Ways and Means, Energy and Commerce",03/31/2004,"Became Public Law No: 108-210."
"S. 2214",https://www.congress.gov/bill/108th-congress/senate-bill/2214,"108th Congress (2003-2004)",,"A bill to designate the facility of the United States Postal Service located at 3150 Great Northern Avenue in Missoula, Montana, as the ""Mike Mansfield Post Office"".","Sen. Burns, Conrad R. [R-MT]",03/12/2004,,,,1,"House - Government Reform | Senate - Governmental Affairs",12/03/2004,"Became Public Law No: 108-440."
"S. 2195",https://www.congress.gov/bill/108th-congress/senate-bill/2195,"108th Congress (2003-2004)",,"Anabolic Steroid Control Act of 2004","Sen. Biden, Joseph R., Jr. [D-DE]",03/11/2004,,,,10,"Senate - Judiciary",10/22/2004,"Became Public Law No: 108-358."
"S. 2192",https://www.congress.gov/bill/108th-congress/senate-bill/2192,"108th Congress (2003-2004)",,"Cooperative Research and Technology Enhancement (CREATE) Act of 2004","Sen. Hatch, Orrin G. [R-UT]",03/10/2004,,,,7,"Senate - Judiciary",12/10/2004,"Became Public Law No: 108-453."
"S. 2180",https://www.congress.gov/bill/108th-congress/senate-bill/2180,"108th Congress (2003-2004)",,"Arapaho and Roosevelt National Forests Land Exchange Act of 2004
","Sen. Campbell, Ben Nighthorse [R-CO]",03/09/2004,,,,1,"Senate - Energy and Natural Resources",10/18/2004,"Became Public Law No: 108-346."
"S. 2178",https://www.congress.gov/bill/108th-congress/senate-bill/2178,"108th Congress (2003-2004)",,"National Park System Laws Technical Amendments Act of 2004","Sen. Domenici, Pete V. [R-NM]",03/09/2004,,,,0,"House - Resources | Senate - Energy and Natural Resources",10/21/2004,"Became Public Law No: 108-352."
"S. 2136",https://www.congress.gov/bill/108th-congress/senate-bill/2136,"108th Congress (2003-2004)",,"An original bill to extend the final report date and termination date of the National Commission on Terrorist Attacks Upon the United States, to provide additional funding for the Commission, and for other purposes.","Sen. Roberts, Pat [R-KS]",02/26/2004,,,,0,"Senate - Intelligence",03/16/2004,"Became Public Law No: 108-207."
"S. 2092",https://www.congress.gov/bill/108th-congress/senate-bill/2092,"108th Congress (2003-2004)",,"A bill to address the participation of Taiwan in the World Health Organization.","Sen. Allen, George [R-VA]",02/12/2004,,,,13,"Senate - Foreign Relations",06/14/2004,"Became Public Law No: 108-235."
"S. 2057",https://www.congress.gov/bill/108th-congress/senate-bill/2057,"108th Congress (2003-2004)",,"A bill to require the Secretary of Defense to reimburse members of the United States Armed Forces for certain transportation expenses incurred by the members in connection with leave under the Central Command Rest and Recuperation Leave Program before the program was expanded to include domestic travel.","Sen. Coleman, Norm [R-MN]",02/09/2004,,,,15,"House - Armed Services | Senate - Armed Services",04/22/2004,"Became Public Law No: 108-220."
"S. 2052",https://www.congress.gov/bill/108th-congress/senate-bill/2052,"108th Congress (2003-2004)",,"El Camino Real de los Tejas National Historic Trail Act","Sen. Hutchison, Kay Bailey [R-TX]",02/05/2004,,,,0,"House - Resources | Senate - Energy and Natural Resources",10/18/2004,"Became Public Law No: 108-342."
"S. 2043",https://www.congress.gov/bill/108th-congress/senate-bill/2043,"108th Congress (2003-2004)",,"A bill to designate a Federal building in Harrisburg, Pennsylvania, as the ""Ronald Reagan Federal Building"".","Sen. Specter, Arlen [R-PA]",02/02/2004,,,,1,"House - Transportation and Infrastructure | Senate - Environment and Public Works",05/07/2004,"Became Public Law No: 108-227."
"S. 2042",https://www.congress.gov/bill/108th-congress/senate-bill/2042,"108th Congress (2003-2004)",,"A bill for the relief of Rocco A. Trecosta of Fort Lauderdale, Florida.","Sen. Graham, Bob [D-FL]",02/02/2004,,,,0,"Senate - Judiciary",12/03/2004,"Became Private Law No: 108-5."
"S. 2022",https://www.congress.gov/bill/108th-congress/senate-bill/2022,"108th Congress (2003-2004)",,"A bill to designate the Federal building located at 250 West Cherry Street in Carbondale, Illinois the ""Senator Paul Simon Federal Building"".","Sen. Durbin, Richard J. [D-IL]",01/22/2004,,,,1,"Senate - Environment and Public Works",05/07/2004,"Became Public Law No: 108-226."
"S. 2017",https://www.congress.gov/bill/108th-congress/senate-bill/2017,"108th Congress (2003-2004)",,"A bill to designate the United States courthouse and post office building located at 93 Atocha Street in Ponce, Puerto Rico, as the ""Luis A. Ferre United States Courthouse and Post Office Building"".","Sen. Santorum, Rick [R-PA]",01/22/2004,,,,0,"Senate - Governmental Affairs",07/07/2004,"Became Public Law No: 108-273."
"S. 1947",https://www.congress.gov/bill/108th-congress/senate-bill/1947,"108th Congress (2003-2004)",,"Preserving Independence of Financial Institution Examinations Act of 2003  
  
","Sen. Leahy, Patrick J. [D-VT]",11/24/2003,,,,1,"House - Judiciary",12/19/2003,"Became Public Law No: 108-198."
"S. 1929",https://www.congress.gov/bill/108th-congress/senate-bill/1929,"108th Congress (2003-2004)",,"Mental Health Parity Reauthorization Act of 2003","Sen. Gregg, Judd [R-NH]",11/21/2003,,,,1,,12/19/2003,"Became Public Law No: 108-197."
"S. 1904",https://www.congress.gov/bill/108th-congress/senate-bill/1904,"108th Congress (2003-2004)",,"A bill to designate the United States courthouse located at 400 North Miami Avenue in Miami, Florida, as the ""Wilkie D. Ferguson, Jr. United States Courthouse"".","Sen. Graham, Bob [D-FL]",11/20/2003,,,,1,"Senate - Environment and Public Works",05/07/2004,"Became Public Law No: 108-225."
"S. 1895",https://www.congress.gov/bill/108th-congress/senate-bill/1895,"108th Congress (2003-2004)",,"A bill to temporarily extend the programs under the Small Business Act and the Small Business Investment Act of 1958 through March 15, 2004, and for other purposes.","Sen. Snowe, Olympia J. [R-ME]",11/19/2003,,,,1,,12/06/2003,"Became Public Law No: 108-172."
"S. 1881",https://www.congress.gov/bill/108th-congress/senate-bill/1881,"108th Congress (2003-2004)",,"Medical Devices Technical Corrections Act","Sen. Alexander, Lamar [R-TN]",11/18/2003,,,,3,"House - Energy and Commerce | Senate - Health, Education, Labor, and Pensions",04/01/2004,"Became Public Law No: 108-214."
"S. 1848",https://www.congress.gov/bill/108th-congress/senate-bill/1848,"108th Congress (2003-2004)",,"A bill to amend the Bend Pine Nursery Land Conveyance Act to direct the Secretary of Agriculture to sell the, Bend Pine Nursery Administration Site in the State of Oregon.","Sen. Wyden, Ron [D-OR]",11/11/2003,,,,1,"Senate - Energy and Natural Resources",07/02/2004,"Became Public Law No: 108-269."
"S. 1824",https://www.congress.gov/bill/108th-congress/senate-bill/1824,"108th Congress (2003-2004)",,"Overseas Private Investment Corporation Amendments Act of 2003","Sen. Lugar, Richard G. [R-IN]",11/05/2003,,,,3,"Senate - Foreign Relations",12/03/2003,"Became Public Law No: 108-158."
"S. 1814",https://www.congress.gov/bill/108th-congress/senate-bill/1814,"108th Congress (2003-2004)",,"A bill to transfer federal lands between the Secretary of Agriculture and the Secretary of the Interior.","Sen. Bond, Christopher S. [R-MO]",11/03/2003,,,,0,"House - Resources, Agriculture, Education and the Workforce | Senate - Environment and Public Works",10/18/2004,"Became Public Law No: 108-341."
"S. 1791",https://www.congress.gov/bill/108th-congress/senate-bill/1791,"108th Congress (2003-2004)",,"A bill to amend the Lease Lot Conveyance Act of 2002 to provide that the amounts received by the United States under that Act shall be deposited in the reclamation fund, and for other purposes.","Sen. Domenici, Pete V. [R-NM]",10/28/2003,,,,1,"House - Resources | Senate - Energy and Natural Resources",10/21/2004,"Became Public Law No: 108-351."
"S. 1778",https://www.congress.gov/bill/108th-congress/senate-bill/1778,"108th Congress (2003-2004)",,"Craig Recreation Land Purchase Act","Sen. Murkowski, Lisa [R-AK]",10/23/2003,,,,1,"Senate - Energy and Natural Resources",10/13/2004,"Became Public Law No: 108-325."
"S. 1768",https://www.congress.gov/bill/108th-congress/senate-bill/1768,"108th Congress (2003-2004)",,"National Flood Insurance Program Reauthorization Act of 2004","Sen. Bunning, Jim [R-KY]",10/21/2003,,,,1,"House - Financial Services | Senate - Banking, Housing, and Urban Affairs",12/06/2003,"Became Public Law No: 108-171."
"S. 1727",https://www.congress.gov/bill/108th-congress/senate-bill/1727,"108th Congress (2003-2004)",,"A bill to authorize additional appropriations for the Reclamation Safety of Dams Act of 1978.","Sen. Domenici, Pete V. [R-NM]",10/14/2003,,,,0,"Senate - Energy and Natural Resources",12/03/2004,"Became Public Law No: 108-439."
"S. 1721",https://www.congress.gov/bill/108th-congress/senate-bill/1721,"108th Congress (2003-2004)",,"American Indian Probate Reform Act of 2004","Sen. Campbell, Ben Nighthorse [R-CO]",10/14/2003,,,,2,"House - Resources | Senate - Indian Affairs",10/27/2004,"Became Public Law No: 108-374."
"S. 1720",https://www.congress.gov/bill/108th-congress/senate-bill/1720,"108th Congress (2003-2004)",,"A bill to provide for Federal court proceedings in Plano, Texas.","Sen. Cornyn, John [R-TX]",10/14/2003,,,,1,"House - Judiciary | Senate - Judiciary",12/03/2003,"Became Public Law No: 108-157."
"S. 1718",https://www.congress.gov/bill/108th-congress/senate-bill/1718,"108th Congress (2003-2004)",,"A bill to designate the facility of the United States Postal Service located at 3710 West 73rd Terrace in Prairie Village, Kansas, as the ""Senator James B. Pearson Post Office"".","Sen. Roberts, Pat [R-KS]",10/14/2003,,,,1,"House - Government Reform | Senate - Governmental Affairs",12/02/2003,"Became Public Law No: 108-144."
"S. 1687",https://www.congress.gov/bill/108th-congress/senate-bill/1687,"108th Congress (2003-2004)",,"Manhattan Project National Historical Park Study Act","Sen. Bingaman, Jeff [D-NM]",09/30/2003,,,,4,"Senate - Energy and Natural Resources",10/18/2004,"Became Public Law No: 108-340."
"S. 1685",https://www.congress.gov/bill/108th-congress/senate-bill/1685,"108th Congress (2003-2004)",,"Basic Pilot Program Extension and Expansion Act of 2003","Sen. Grassley, Chuck [R-IA]",09/30/2003,,,,3,"Senate - Judiciary",12/03/2003,"Became Public Law No: 108-156."
"S. 1683",https://www.congress.gov/bill/108th-congress/senate-bill/1683,"108th Congress (2003-2004)",,"Federal Law Enforcement Pay and Benefits Parity Act of 2003","Sen. Voinovich, George V. [R-OH]",09/30/2003,,,,1,"House - Government Reform | Senate - Governmental Affairs",12/19/2003,"Became Public Law No: 108-196."
"S. 1680",https://www.congress.gov/bill/108th-congress/senate-bill/1680,"108th Congress (2003-2004)",,"Defense Production Act Reauthorization of 2003","Sen. Shelby, Richard C. [R-AL]",09/30/2003,,,,0,"House - Financial Services | Senate - Banking, Housing, and Urban Affairs",12/19/2003,"Became Public Law No: 108-195."
"S. 1663",https://www.congress.gov/bill/108th-congress/senate-bill/1663,"108th Congress (2003-2004)",,"A bill to replace certain Coastal Barrier Resources System maps.","Sen. Dole, Elizabeth [R-NC]",09/25/2003,,,,0,"House - Resources | Senate - Environment and Public Works",10/18/2004,"Became Public Law No: 108-339."
"S. 1591",https://www.congress.gov/bill/108th-congress/senate-bill/1591,"108th Congress (2003-2004)",,"A bill to redesignate the facility of the United States Postal Service located at 48 South Broadway, Nyack, New York, as the ""Edward O'Grady, Waverly Brown, Peter Paige Post Office Building"".","Sen. Schumer, Charles E. [D-NY]",09/08/2003,,,,1,"House - Government Reform | Senate - Governmental Affairs",10/29/2003,"Became Public Law No: 108-103."
"S. 1590",https://www.congress.gov/bill/108th-congress/senate-bill/1590,"108th Congress (2003-2004)",,"A bill to redesignate the facility of the United States Postal Service, located at 315 Empire Boulevard in Crown Heights, Brooklyn, New York, as the ""James E. Davis Post Office Building"".","Sen. Schumer, Charles E. [D-NY]",09/08/2003,,,,1,"House - Government Reform | Senate - Governmental Affairs",12/01/2003,"Became Public Law No: 108-141."
"S. 1576",https://www.congress.gov/bill/108th-congress/senate-bill/1576,"108th Congress (2003-2004)",,"Harpers Ferry National Historical Park Boundary Revision Act of 2004","Sen. Byrd, Robert C. [D-WV]",09/03/2003,,,,1,"House - Resources | Senate - Energy and Natural Resources",09/24/2004,"Became Public Law No: 108-307."
"S. 1537",https://www.congress.gov/bill/108th-congress/senate-bill/1537,"108th Congress (2003-2004)",,"A bill to direct the Secretary of Agriculture to convey to the New Hope Cemetery Association certain land in the State of Arkansas for use as a cemetery.","Sen. Lincoln, Blanche L. [D-AR]",07/31/2003,,,,0,"House - Resources | Senate - Agriculture, Nutrition, and Forestry",10/18/2004,"Became Public Law No: 108-338."
"S. 1466",https://www.congress.gov/bill/108th-congress/senate-bill/1466,"108th Congress (2003-2004)",,"Alaska Land Transfer Acceleration Act of 2003","Sen. Murkowski, Lisa [R-AK]",07/25/2003,,,,1,"House - Resources | Senate - Energy and Natural Resources",12/10/2004,"Became Public Law No: 108-452."
"S. 1435",https://www.congress.gov/bill/108th-congress/senate-bill/1435,"108th Congress (2003-2004)",,"Prison Rape Elimination Act of 2003","Sen. Sessions, Jeff [R-AL]",07/21/2003,,,,4,,09/04/2003,"Became Public Law No: 108-79."
"S. 1421",https://www.congress.gov/bill/108th-congress/senate-bill/1421,"108th Congress (2003-2004)",,"Alaska Native Allotment Subdivision Act","Sen. Murkowski, Lisa [R-AK]",07/16/2003,,,,0,"House - Resources | Senate - Energy and Natural Resources",10/18/2004,"Became Public Law No: 108-337."
"S. 1399",https://www.congress.gov/bill/108th-congress/senate-bill/1399,"108th Congress (2003-2004)",,"A bill to redesignate the facility of the United States Postal Service located at 101 South Vine Street in Glenwood, Iowa, as the ""William J. Scherle Post Office Building"".","Sen. Harkin, Tom [D-IA]",07/14/2003,,,,1,"House - Government Reform | Senate - Governmental Affairs",07/29/2003,"Became Public Law No: 108-65."
