"S. 97",https://www.congress.gov/bill/115th-congress/senate-bill/97,"115th Congress (2017-2018)",,"Nuclear Energy Innovation Capabilities Act of 2017","Sen. Crapo, Mike [R-ID]",01/11/2017,,,,7,"Senate - Energy and Natural Resources",09/28/2018,"Became Public Law No: 115-248."
"S. 96",https://www.congress.gov/bill/115th-congress/senate-bill/96,"115th Congress (2017-2018)",,"Improving Rural Call Quality and Reliability Act of 2017","Sen. Klobuchar, Amy [D-MN]",01/11/2017,,,,8,"Senate - Commerce, Science, and Transportation",02/26/2018,"Became Public Law No: 115-129."
"S. 84",https://www.congress.gov/bill/115th-congress/senate-bill/84,"115th Congress (2017-2018)",,"A bill to provide for an exception to a limitation against appointment of persons as Secretary of Defense within seven years of relief from active duty as a regular commissioned officer of the Armed Forces.","Sen. McCain, John [R-AZ]",01/10/2017,,,,0,"Senate - Armed Services",01/20/2017,"Became Public Law No: 115-2."
"S. 35",https://www.congress.gov/bill/115th-congress/senate-bill/35,"115th Congress (2017-2018)",,"Black Hills National Cemetery Boundary Expansion Act","Sen. Thune, John [R-SD]",01/05/2017,,,,2,"House - Natural Resources, Veterans' Affairs | Senate - Energy and Natural Resources",05/25/2018,"Became Public Law No: 115-175."
"S. 7",https://www.congress.gov/bill/115th-congress/senate-bill/7,"115th Congress (2017-2018)",,"NASA Enhanced Use Leasing Extension Act of 2018","Sen. Wicker, Roger F. [R-MS]",11/27/2018,,,,0,"Senate - Commerce, Science, and Transportation",12/31/2018,"Became Public Law No: 115-403."
"S.J.Res. 60",https://www.congress.gov/bill/115th-congress/senate-joint-resolution/60,"115th Congress (2017-2018)",,"A joint resolution providing for the reappointment of Barbara M. Barrett as a citizen regent of the Board of Regents of the Smithsonian Institution.","Sen. Boozman, John [R-AR]",04/24/2018,,,,2,"House - House Administration | Senate - Rules and Administration",07/20/2018,"Became Public Law No: 115-199."
"S.J.Res. 57",https://www.congress.gov/bill/115th-congress/senate-joint-resolution/57,"115th Congress (2017-2018)",,"A joint resolution providing for congressional disapproval under chapter 8 of title 5, United States Code, of the rule submitted by Bureau of Consumer Financial Protection relating to ""Indirect Auto Lending and Compliance with the Equal Credit Opportunity Act"".","Sen. Moran, Jerry [R-KS]",03/22/2018,,,,24,"Senate - Banking, Housing, and Urban Affairs",05/21/2018,"Became Public Law No: 115-172."
"S.J.Res. 49",https://www.congress.gov/bill/115th-congress/senate-joint-resolution/49,"115th Congress (2017-2018)",,"A joint resolution condemning the violence and domestic terrorist attack that took place during events between August 11 and August 12, 2017, in Charlottesville, Virginia, recognizing the first responders who lost their lives while monitoring the events, offering deepest condolences to the families and friends of those individuals who were killed and deepest sympathies and support to those individuals who were injured by the violence, expressing support for the Charlottesville community, rejecting White nationalists, White supremacists, the Ku Klux Klan, neo-Nazis, and other hate groups, and urging the President and the President's Cabinet to use all available resources to address the threats posed by those groups.","Sen. Warner, Mark R. [D-VA]",09/06/2017,,,,56,,09/14/2017,"Became Public Law No: 115-58."
"S.J.Res. 36",https://www.congress.gov/bill/115th-congress/senate-joint-resolution/36,"115th Congress (2017-2018)",,"A joint resolution providing for the appointment of Roger W. Ferguson as a citizen regent of the Board of Regents of the Smithsonian Institution.","Sen. Boozman, John [R-AR]",03/08/2017,,,,2,"House - House Administration | Senate - Rules and Administration",04/19/2017,"Became Public Law No: 115-29."
"S.J.Res. 35",https://www.congress.gov/bill/115th-congress/senate-joint-resolution/35,"115th Congress (2017-2018)",,"A joint resolution providing for the appointment of Michael Govan as a citizen regent of the Board of Regents of the Smithsonian Institution.","Sen. Boozman, John [R-AR]",03/08/2017,,,,2,"House - House Administration | Senate - Rules and Administration",04/19/2017,"Became Public Law No: 115-28."
"S.J.Res. 34",https://www.congress.gov/bill/115th-congress/senate-joint-resolution/34,"115th Congress (2017-2018)",,"A joint resolution providing for congressional disapproval under chapter 8 of title 5, United States Code, of the rule submitted by the Federal Communications Commission relating to ""Protecting the Privacy of Customers of Broadband and Other Telecommunications Services"".","Sen. Flake, Jeff [R-AZ]",03/07/2017,,,,24,"Senate - Commerce, Science, and Transportation",04/03/2017,"Became Public Law No: 115-22."
"S.J.Res. 30",https://www.congress.gov/bill/115th-congress/senate-joint-resolution/30,"115th Congress (2017-2018)",,"A joint resolution providing for the reappointment of Steve Case as a citizen regent of the Board of Regents of the Smithsonian Institution.","Sen. Perdue, David [R-GA]",03/02/2017,,,,2,"House - House Administration | Senate - Rules and Administration",04/19/2017,"Became Public Law No: 115-27."
"S.J.Res. 1",https://www.congress.gov/bill/115th-congress/senate-joint-resolution/1,"115th Congress (2017-2018)",,"A joint resolution approving the location of a memorial to commemorate and honor the members of the Armed Forces who served on active duty in support of Operation Desert Storm or Operation Desert Shield.","Sen. Boozman, John [R-AR]",01/03/2017,,,,24,"Senate - Energy and Natural Resources",03/31/2017,"Became Public Law No: 115-18."
"S. 3492",https://www.congress.gov/bill/114th-congress/senate-bill/3492,"114th Congress (2015-2016)",,"A bill to designate the Traverse City VA Community-Based Outpatient Clinic of the Department of Veterans Affairs in Traverse City, Michigan, as the ""Colonel Demas T. Craw VA Clinic"".","Sen. Peters, Gary C. [D-MI]",12/01/2016,,,,1,"House - Veterans' Affairs",12/14/2016,"Became Public Law No: 114-276."
"S. 3395",https://www.congress.gov/bill/114th-congress/senate-bill/3395,"114th Congress (2015-2016)",,"Prescribed Burn Approval Act of 2016","Sen. Thune, John [R-SD]",09/27/2016,,,,1,"House - Agriculture, Natural Resources | Senate - Agriculture, Nutrition, and Forestry",12/14/2016,"Became Public Law No: 114-275."
"S. 3283",https://www.congress.gov/bill/114th-congress/senate-bill/3283,"114th Congress (2015-2016)",,"A bill to designate the community-based outpatient clinic of the Department of Veterans Affairs in Pueblo, Colorado, as the ""PFC James Dunn VA Clinic"".","Sen. Gardner, Cory [R-CO]",07/14/2016,,,,1,"House - Veterans' Affairs",10/07/2016,"Became Public Law No: 114-243."
"S. 3207",https://www.congress.gov/bill/114th-congress/senate-bill/3207,"114th Congress (2015-2016)",,"A bill to authorize the National Library Service for the Blind and Physically Handicapped to provide playback equipment in all formats.","Sen. Schumer, Charles E. [D-NY]",07/13/2016,,,,1,,07/29/2016,"Became Public Law No: 114-219."
"S. 3183",https://www.congress.gov/bill/114th-congress/senate-bill/3183,"114th Congress (2015-2016)",,"BOTS Act of 2016","Sen. Moran, Jerry [R-KS]",07/13/2016,,,,8,"Senate - Commerce, Science, and Transportation",12/14/2016,"Became Public Law No: 114-274."
"S. 3084",https://www.congress.gov/bill/114th-congress/senate-bill/3084,"114th Congress (2015-2016)",,"American Innovation and Competitiveness Act","Sen. Gardner, Cory [R-CO]",06/22/2016,,,,3,"Senate - Commerce, Science, and Transportation",01/06/2017,"Became Public Law No: 114-329."
"S. 3076",https://www.congress.gov/bill/114th-congress/senate-bill/3076,"114th Congress (2015-2016)",,"Charles Duncan Buried with Honor Act of 2016","Sen. Cotton, Tom [R-AR]",06/20/2016,,,,1,"House - Veterans' Affairs | Senate - Veterans' Affairs",12/14/2016,"Became Public Law No: 114-273."
"S. 3055",https://www.congress.gov/bill/114th-congress/senate-bill/3055,"114th Congress (2015-2016)",,"Department of Veterans Affairs Dental Insurance Reauthorization Act of 2016","Sen. Burr, Richard [R-NC]",06/14/2016,,,,1,"Senate - Veterans' Affairs",07/29/2016,"Became Public Law No: 114-218."
"S. 3028",https://www.congress.gov/bill/114th-congress/senate-bill/3028,"114th Congress (2015-2016)",,"Daniel J. Evans Olympic National Park Wilderness Act","Sen. Cantwell, Maria [D-WA]",06/07/2016,,,,1,"House - Natural Resources | Senate - Energy and Natural Resources",12/14/2016,"Became Public Law No: 114-272."
"S. 2974",https://www.congress.gov/bill/114th-congress/senate-bill/2974,"114th Congress (2015-2016)",,"A bill to ensure funding for the National Human Trafficking Hotline, and for other purposes.","Sen. Klobuchar, Amy [D-MN]",05/23/2016,,,,1,"Senate - Health, Education, Labor, and Pensions",12/14/2016,"Became Public Law No: 114-271."
"S. 2971",https://www.congress.gov/bill/114th-congress/senate-bill/2971,"114th Congress (2015-2016)",,"National Urban Search and Rescue Response System Act of 2016","Sen. Portman, Rob [R-OH]",05/23/2016,,,,7,"House - Transportation and Infrastructure | Senate - Homeland Security and Governmental Affairs",12/16/2016,"Became Public Law No: 114-326."
"S. 2943",https://www.congress.gov/bill/114th-congress/senate-bill/2943,"114th Congress (2015-2016)",,"National Defense Authorization Act for Fiscal Year 2017","Sen. McCain, John [R-AZ]",05/18/2016,,,,0,"Senate - Armed Services",12/23/2016,"Became Public Law No: 114-328."
"S. 2893",https://www.congress.gov/bill/114th-congress/senate-bill/2893,"114th Congress (2015-2016)",,"Library of Congress Sound Recording and Film Preservation Programs Reauthorization Act of 2016","Sen. Grassley, Chuck [R-IA]",04/28/2016,,,,1,"Senate - Rules and Administration",07/29/2016,"Became Public Law No: 114-217."
"S. 2873",https://www.congress.gov/bill/114th-congress/senate-bill/2873,"114th Congress (2015-2016)",,"ECHO Act","Sen. Hatch, Orrin G. [R-UT]",04/28/2016,,,,16,"House - Energy and Commerce | Senate - Health, Education, Labor, and Pensions",12/14/2016,"Became Public Law No: 114-270."
"S. 2854",https://www.congress.gov/bill/114th-congress/senate-bill/2854,"114th Congress (2015-2016)",,"Emmett Till Unsolved Civil Rights Crimes Reauthorization Act of 2016","Sen. Burr, Richard [R-NC]",04/26/2016,,,,16,"House - Judiciary | Senate - Judiciary",12/16/2016,"Became Public Law No: 114-325."
"S. 2845",https://www.congress.gov/bill/114th-congress/senate-bill/2845,"114th Congress (2015-2016)",,"Venezuela Defense of Human Rights and Civil Society Extension Act of 2016","Sen. Rubio, Marco [R-FL]",04/25/2016,,,,2,"House - Foreign Affairs, Judiciary | Senate - Foreign Relations",07/15/2016,"Became Public Law No: 114-194."
"S. 2840",https://www.congress.gov/bill/114th-congress/senate-bill/2840,"114th Congress (2015-2016)",,"Protecting Our Lives by Initiating COPS Expansion Act of 2016","Sen. Cornyn, John [R-TX]",04/21/2016,,,,19,"House - Judiciary | Senate - Judiciary",07/22/2016,"Became Public Law No: 114-199."
"S. 2755",https://www.congress.gov/bill/114th-congress/senate-bill/2755,"114th Congress (2015-2016)",,"Fallen Heroes Flag Act of 2016","Sen. Blunt, Roy [R-MO]",04/06/2016,,,,24,"Senate - Rules and Administration",05/16/2016,"Became Public Law No: 114-156."
"S. 2754",https://www.congress.gov/bill/114th-congress/senate-bill/2754,"114th Congress (2015-2016)",,"To designate the Federal building and United States courthouse located at 300 Fannin Street in Shreveport, Louisiana, as the ""Tom Stagg United States Court House"".","Sen. Cassidy, Bill [R-LA]",04/06/2016,,,,1,"Senate - Environment and Public Works",12/08/2016,"Became Public Law No: 114-253."
"S. 2683",https://www.congress.gov/bill/114th-congress/senate-bill/2683,"114th Congress (2015-2016)",,"Federal Aviation Administration Veteran Transition Improvement Act of 2016","Sen. Hirono, Mazie K. [D-HI]",03/15/2016,,,,3,"Senate - Commerce, Science, and Transportation",10/07/2016,"Became Public Law No: 114-242."
"S. 2577",https://www.congress.gov/bill/114th-congress/senate-bill/2577,"114th Congress (2015-2016)",,"Justice for All Reauthorization Act of 2016","Sen. Cornyn, John [R-TX]",02/24/2016,,,,17,"House - Judiciary, Financial Services | Senate - Judiciary",12/16/2016,"Became Public Law No: 114-324."
"S. 2512",https://www.congress.gov/bill/114th-congress/senate-bill/2512,"114th Congress (2015-2016)",,"Adding Zika Virus to the FDA Priority Review Voucher Program Act","Sen. Franken, Al [D-MN]",02/08/2016,,,,11,"House - Energy and Commerce | Senate - Health, Education, Labor, and Pensions",04/19/2016,"Became Public Law No: 114-146."
"S. 2487",https://www.congress.gov/bill/114th-congress/senate-bill/2487,"114th Congress (2015-2016)",,"Female Veteran Suicide Prevention Act","Sen. Boxer, Barbara [D-CA]",02/03/2016,,,,23,"Senate - Veterans' Affairs",06/30/2016,"Became Public Law No: 114-188."
"S. 2426",https://www.congress.gov/bill/114th-congress/senate-bill/2426,"114th Congress (2015-2016)",,"A bill to direct the Secretary of State to develop a strategy to obtain observer status for Taiwan in the International Criminal Police Organization, and for other purposes.","Sen. Gardner, Cory [R-CO]",12/18/2015,,,,30,"Senate - Foreign Relations",03/18/2016,"Became Public Law No: 114-139."
"S. 2425",https://www.congress.gov/bill/114th-congress/senate-bill/2425,"114th Congress (2015-2016)",,"Patient Access and Medicare Protection Act","Sen. Portman, Rob [R-OH]",12/18/2015,,,,10,,12/28/2015,"Became Public Law No: 114-115."
"S. 2393",https://www.congress.gov/bill/114th-congress/senate-bill/2393,"114th Congress (2015-2016)",,"Foreclosure Relief and Extension for Servicemembers Act of 2015","Sen. Whitehouse, Sheldon [D-RI]",12/10/2015,,,,9,,03/31/2016,"Became Public Law No: 114-142."
"S. 2328",https://www.congress.gov/bill/114th-congress/senate-bill/2328,"114th Congress (2015-2016)",,PROMESA,"Sen. Wicker, Roger F. [R-MS]",11/19/2015,,,,3,"House - Natural Resources",06/30/2016,"Became Public Law No: 114-187."
"S. 2276",https://www.congress.gov/bill/114th-congress/senate-bill/2276,"114th Congress (2015-2016)",,"PIPES Act of 2016","Sen. Fischer, Deb [R-NE]",11/10/2015,,,,5,"Senate - Commerce, Science, and Transportation",06/22/2016,"Became Public Law No: 114-183."
"S. 2234",https://www.congress.gov/bill/114th-congress/senate-bill/2234,"114th Congress (2015-2016)",,"Office of Strategic Services Congressional Gold Medal Act","Sen. Blunt, Roy [R-MO]",11/04/2015,,,,73,"House - Financial Services, House Administration | Senate - Banking, Housing, and Urban Affairs",12/14/2016,"Became Public Law No: 114-269."
"S. 2162",https://www.congress.gov/bill/114th-congress/senate-bill/2162,"114th Congress (2015-2016)",,"Librarian of Congress Succession Modernization Act of 2015","Sen. Blunt, Roy [R-MO]",10/07/2015,,,,4,"House - House Administration",11/05/2015,"Became Public Law No: 114-86."
"S. 2152",https://www.congress.gov/bill/114th-congress/senate-bill/2152,"114th Congress (2015-2016)",,"Electrify Africa Act of 2015","Sen. Corker, Bob [R-TN]",10/07/2015,,,,23,"House - Foreign Affairs | Senate - Foreign Relations",02/08/2016,"Became Public Law No: 114-121."
"S. 2143",https://www.congress.gov/bill/114th-congress/senate-bill/2143,"114th Congress (2015-2016)",,"A bill to provide for the authority for the successors and assigns of the Starr-Camargo Bridge Company to maintain and operate a toll bridge across the Rio Grande near Rio Grande City, Texas, and for other purposes.","Sen. Cornyn, John [R-TX]",10/06/2015,,,,0,"House - Foreign Affairs | Senate - Environment and Public Works",05/20/2016,"Became Public Law No: 114-163."
"S. 2133",https://www.congress.gov/bill/114th-congress/senate-bill/2133,"114th Congress (2015-2016)",,"Fraud Reduction and Data Analytics Act of 2015","Sen. Carper, Thomas R. [D-DE]",10/05/2015,,,,5,"Senate - Homeland Security and Governmental Affairs",06/30/2016,"Became Public Law No: 114-186."
"S. 2109",https://www.congress.gov/bill/114th-congress/senate-bill/2109,"114th Congress (2015-2016)",,"Directing Dollars to Disaster Relief Act of 2015","Sen. Johnson, Ron [R-WI]",09/30/2015,,,,2,"House - Transportation and Infrastructure | Senate - Homeland Security and Governmental Affairs",02/29/2016,"Became Public Law No: 114-132."
"S. 2082",https://www.congress.gov/bill/114th-congress/senate-bill/2082,"114th Congress (2015-2016)",,"Department of Veterans Affairs Expiring Authorities Act of 2015","Sen. Isakson, Johnny [R-GA]",09/25/2015,,,,1,,09/30/2015,"Became Public Law No: 114-58."
"S. 2078",https://www.congress.gov/bill/114th-congress/senate-bill/2078,"114th Congress (2015-2016)",,"United States Commission on International Religious Freedom Reauthorization Act of 2015","Sen. Corker, Bob [R-TN]",09/24/2015,,,,0,"Senate - Foreign Relations",10/16/2015,"Became Public Law No: 114-71."
"S. 2040",https://www.congress.gov/bill/114th-congress/senate-bill/2040,"114th Congress (2015-2016)",,"Justice Against Sponsors of Terrorism Act","Sen. Cornyn, John [R-TX]",09/16/2015,,,,25,"House - Judiciary | Senate - Judiciary",09/28/2016,"Became Public Law No: 114-222."
"S. 2036",https://www.congress.gov/bill/114th-congress/senate-bill/2036,"114th Congress (2015-2016)",,"Equity in Government Compensation Act of 2015","Sen. Vitter, David [R-LA]",09/15/2015,,,,1,,11/25/2015,"Became Public Law No: 114-93."
"S. 1915",https://www.congress.gov/bill/114th-congress/senate-bill/1915,"114th Congress (2015-2016)",,"First Responder Anthrax Preparedness Act","Sen. Ayotte, Kelly [R-NH]",08/03/2015,,,,19,"Senate - Homeland Security and Governmental Affairs",12/14/2016,"Became Public Law No: 114-268."
"S. 1890",https://www.congress.gov/bill/114th-congress/senate-bill/1890,"114th Congress (2015-2016)",,"Defend Trade Secrets Act of 2016","Sen. Hatch, Orrin G. [R-UT]",07/29/2015,,,,65,"House - Judiciary | Senate - Judiciary",05/11/2016,"Became Public Law No: 114-153."
"S. 1878",https://www.congress.gov/bill/114th-congress/senate-bill/1878,"114th Congress (2015-2016)",,"Advancing Hope Act of 2016","Sen. Casey, Robert P., Jr. [D-PA]",07/28/2015,,,,3,"House - Energy and Commerce | Senate - Health, Education, Labor, and Pensions",09/30/2016,"Became Public Law No: 114-229."
"S. 1826",https://www.congress.gov/bill/114th-congress/senate-bill/1826,"114th Congress (2015-2016)",,"A bill to designate the facility of the United States Postal Service located at 99 West 2nd Street in Fond du Lac, Wisconsin, as the Lieutenant Colonel James ""Maggie"" Megellas Post Office.","Sen. Johnson, Ron [R-WI]",07/22/2015,,,,2,"House - Oversight and Government Reform | Senate - Homeland Security and Governmental Affairs",03/18/2016,"Became Public Law No: 114-138."
"S. 1808",https://www.congress.gov/bill/114th-congress/senate-bill/1808,"114th Congress (2015-2016)",,"Northern Border Security Review Act","Sen. Heitkamp, Heidi [D-ND]",07/21/2015,,,,7,"Senate - Homeland Security and Governmental Affairs",12/14/2016,"Became Public Law No: 114-267."
"S. 1707",https://www.congress.gov/bill/114th-congress/senate-bill/1707,"114th Congress (2015-2016)",,"A bill to designate the Federal building located at 617 Walnut Street in Helena, Arkansas, as the ""Jacob Trieber Federal Building, United States Post Office, and United States Court House"".","Sen. Boozman, John [R-AR]",07/07/2015,,,,2,"Senate - Environment and Public Works",10/07/2015,"Became Public Law No: 114-67."
"S. 1698",https://www.congress.gov/bill/114th-congress/senate-bill/1698,"114th Congress (2015-2016)",,"Treatment of Certain Payments in Eugenics Compensation Act","Sen. Tillis, Thom [R-NC]",06/25/2015,,,,5,"House - Oversight and Government Reform",10/07/2016,"Became Public Law No: 114-241."
"S. 1638",https://www.congress.gov/bill/114th-congress/senate-bill/1638,"114th Congress (2015-2016)",,"Department of Homeland Security Headquarters Consolidation Accountability Act of 2015","Sen. Johnson, Ron [R-WI]",06/18/2015,,,,1,"Senate - Homeland Security and Governmental Affairs",04/29/2016,"Became Public Law No: 114-150."
"S. 1635",https://www.congress.gov/bill/114th-congress/senate-bill/1635,"114th Congress (2015-2016)",,"Department of State Authorities Act, Fiscal Year 2017","Sen. Corker, Bob [R-TN]",06/18/2015,,,,0,"House - Foreign Affairs | Senate - Foreign Relations",12/16/2016,"Became Public Law No: 114-323."
"S. 1632",https://www.congress.gov/bill/114th-congress/senate-bill/1632,"114th Congress (2015-2016)",,"A bill to require a regional strategy to address the threat posed by Boko Haram.","Sen. Collins, Susan M. [R-ME]",06/18/2015,,,,18,"House - Foreign Affairs, Intelligence (Permanent) | Senate - Foreign Relations",12/14/2016,"Became Public Law No: 114-266."
"S. 1629",https://www.congress.gov/bill/114th-congress/senate-bill/1629,"114th Congress (2015-2016)",,"District of Columbia Courts, Public Defender Service, and Court Services and Offender Supervision Agency Act of 2015","Sen. Johnson, Ron [R-WI]",06/18/2015,,,,1,"House - Oversight and Government Reform | Senate - Homeland Security and Governmental Affairs",01/28/2016,"Became Public Law No: 114-118."
"S. 1596",https://www.congress.gov/bill/114th-congress/senate-bill/1596,"114th Congress (2015-2016)",,"A bill to designate the facility of the United States Postal Service located at 2082 Stringtown Road in Grove City, Ohio, as the ""Specialist Joseph W. Riley Post Office Building"".","Sen. Portman, Rob [R-OH]",06/17/2015,,,,1,"House - Oversight and Government Reform | Senate - Homeland Security and Governmental Affairs",03/09/2016,"Became Public Law No: 114-134."
"S. 1580",https://www.congress.gov/bill/114th-congress/senate-bill/1580,"114th Congress (2015-2016)",,"Competitive Service Act of 2015","Sen. Tester, Jon [D-MT]",06/16/2015,,,,6,"House - Oversight and Government Reform | Senate - Homeland Security and Governmental Affairs",03/18/2016,"Became Public Law No: 114-137."
"S. 1579",https://www.congress.gov/bill/114th-congress/senate-bill/1579,"114th Congress (2015-2016)",,"NATIVE Act","Sen. Schatz, Brian [D-HI]",06/16/2015,,,,11,"House - Natural Resources, Energy and Commerce, House Administration | Senate - Indian Affairs",09/23/2016,"Became Public Law No: 114-221."
"S. 1568",https://www.congress.gov/bill/114th-congress/senate-bill/1568,"114th Congress (2015-2016)",,"A bill to extend the authorization to carry out the replacement of the existing medical center of the Department of Veterans Affairs in Denver, Colorado, to authorize transfers of amounts to carry out the replacement of such medical center, and for other purposes.","Sen. Gardner, Cory [R-CO]",06/11/2015,,,,2,,06/15/2015,"Became Public Law No: 114-25."
"S. 1555",https://www.congress.gov/bill/114th-congress/senate-bill/1555,"114th Congress (2015-2016)",,"Filipino Veterans of World War II Congressional Gold Medal Act of 2015","Sen. Hirono, Mazie K. [D-HI]",06/11/2015,,,,71,"House - Financial Services, House Administration | Senate - Banking, Housing, and Urban Affairs",12/14/2016,"Became Public Law No: 114-265."
"S. 1550",https://www.congress.gov/bill/114th-congress/senate-bill/1550,"114th Congress (2015-2016)",,"Program Management Improvement Accountability Act","Sen. Ernst, Joni  [R-IA]",06/10/2015,,,,2,"House - Oversight and Government Reform | Senate - Homeland Security and Governmental Affairs",12/14/2016,"Became Public Law No: 114-264."
"S. 1523",https://www.congress.gov/bill/114th-congress/senate-bill/1523,"114th Congress (2015-2016)",,"A bill to amend the Federal Water Pollution Control Act to reauthorize the National Estuary Program, and for other purposes.","Sen. Whitehouse, Sheldon [D-RI]",06/08/2015,,,,2,"Senate - Environment and Public Works",05/20/2016,"Became Public Law No: 114-162."
"S. 1492",https://www.congress.gov/bill/114th-congress/senate-bill/1492,"114th Congress (2015-2016)",,"A bill to direct the Administrator of General Services, on behalf of the Archivist of the United States, to convey certain Federal property located in the State of Alaska to the Municipality of Anchorage, Alaska.","Sen. Sullivan, Dan  [R-AK]",06/03/2015,,,,0,"Senate - Homeland Security and Governmental Affairs",05/20/2016,"Became Public Law No: 114-161."
"S. 1482",https://www.congress.gov/bill/114th-congress/senate-bill/1482,"114th Congress (2015-2016)",,"Need-Based Educational Aid Act of 2015","Sen. Grassley, Chuck [R-IA]",06/02/2015,,,,2,"Senate - Judiciary",08/06/2015,"Became Public Law No: 114-44."
"S. 1461",https://www.congress.gov/bill/114th-congress/senate-bill/1461,"114th Congress (2015-2016)",,"A bill to provide for the extension of the enforcement instruction on supervision requirements for outpatient therapeutic services in critical access and small rural hospitals through 2015.","Sen. Thune, John [R-SD]",05/22/2015,,,,7,"House - Energy and Commerce, Ways and Means | Senate - Finance",12/18/2015,"Became Public Law No: 114-112."
"S. 1362",https://www.congress.gov/bill/114th-congress/senate-bill/1362,"114th Congress (2015-2016)",,"A bill to amend title XI of the Social Security Act to clarify waiver authority regarding programs of all-inclusive care for the elderly (PACE programs).","Sen. Carper, Thomas R. [D-DE]",05/18/2015,,,,7,"House - Ways and Means, Energy and Commerce | Senate - Finance",11/05/2015,"Became Public Law No: 114-85."
"S. 1359",https://www.congress.gov/bill/114th-congress/senate-bill/1359,"114th Congress (2015-2016)",,"E-Warranty Act of 2015","Sen. Fischer, Deb [R-NE]",05/14/2015,,,,1,"House - Energy and Commerce | Senate - Commerce, Science, and Transportation",09/24/2015,"Became Public Law No: 114-51."
"S. 1356",https://www.congress.gov/bill/114th-congress/senate-bill/1356,"114th Congress (2015-2016)",,"National Defense Authorization Act for Fiscal Year 2016","Sen. Johnson, Ron [R-WI]",05/14/2015,,,,3,,11/25/2015,"Became Public Law No: 114-92."
