"S. 2690",https://www.congress.gov/bill/107th-congress/senate-bill/2690,"107th Congress (2001-2002)",,"A bill to reaffirm the reference to one Nation under God in the Pledge of Allegiance.","Sen. Hutchinson, Tim [R-AR]",06/27/2002,,,,35,"House - Judiciary",11/13/2002,"Became Public Law No: 107-293."
"S. 2594",https://www.congress.gov/bill/107th-congress/senate-bill/2594,"107th Congress (2001-2002)",,"Support of American Eagle Silver Bullion Program Act","Sen. Reid, Harry [D-NV]",06/06/2002,,,,5,"House - Financial Services | Senate - Banking, Housing, and Urban Affairs",07/23/2002,"Became Public Law No: 107-201."
"S. 2578",https://www.congress.gov/bill/107th-congress/senate-bill/2578,"107th Congress (2001-2002)",,"A bill to amend title 31 of the United States Code to increase the public debt limit.","Sen. Daschle, Thomas A. [D-SD]",06/04/2002,,,,0,,06/28/2002,"Became Public Law No: 107-199."
"S. 2558",https://www.congress.gov/bill/107th-congress/senate-bill/2558,"107th Congress (2001-2002)",,"Benign Brain Tumor Cancer Registries Amendment Act","Sen. Reed, Jack [D-RI]",05/23/2002,,,,11,"House - Energy and Commerce | Senate - Health, Education, Labor, and Pensions",10/29/2002,"Became Public Law No: 107-260."
"S. 2431",https://www.congress.gov/bill/107th-congress/senate-bill/2431,"107th Congress (2001-2002)",,"Mychal Judge Police and Fire Chaplains Public Safety Officers' Benefit Act of 2002","Sen. Leahy, Patrick J. [D-VT]",05/01/2002,,,,5,"Senate - Judiciary",06/24/2002,"Became Public Law No: 107-196."
"S. 2248",https://www.congress.gov/bill/107th-congress/senate-bill/2248,"107th Congress (2001-2002)",,"A bill to extend the authority of the Export-Import Bank until May 31, 2002.","Sen. Sarbanes, Paul S. [D-MD]",04/24/2002,,,,0,,05/01/2002,"Became Public Law No: 107-168."
"S. 2239",https://www.congress.gov/bill/107th-congress/senate-bill/2239,"107th Congress (2001-2002)",,"FHA Downpayment Simplification Act of 2002","Sen. Sarbanes, Paul S. [D-MD]",04/24/2002,,,,24,"House - Financial Services | Senate - Banking, Housing, and Urban Affairs",12/04/2002,"Became Public Law No: 107-326."
"S. 2237",https://www.congress.gov/bill/107th-congress/senate-bill/2237,"107th Congress (2001-2002)",,"Veterans Benefits Improvement Act of 2002","Sen. Rockefeller, John D., IV [D-WV]",04/24/2002,,,,1,"Senate - Veterans' Affairs",12/06/2002,"Became Public Law No: 107-330."
"S. 2019",https://www.congress.gov/bill/107th-congress/senate-bill/2019,"107th Congress (2001-2002)",,"A bill to extend the authority of the Export-Import Bank until April 30, 2002.","Sen. Sarbanes, Paul S. [D-MD]",03/14/2002,,,,0,"House - Financial Services",03/31/2002,"Became Public Law No: 107-156."
"S. 2017",https://www.congress.gov/bill/107th-congress/senate-bill/2017,"107th Congress (2001-2002)",,"Indian Financing Amendments Act of 2002","Sen. Campbell, Ben Nighthorse [R-CO]",03/14/2002,,,,3,"Senate - Indian Affairs",12/13/2002,"Became Public Law No: 107-331."
"S. 1946",https://www.congress.gov/bill/107th-congress/senate-bill/1946,"107th Congress (2001-2002)",,"Old Spanish Trail Recognition Act of 2002","Sen. Campbell, Ben Nighthorse [R-CO]",02/14/2002,,,,3,"House - Resources | Senate - Energy and Natural Resources",12/04/2002,"Became Public Law No: 107-325."
"S. 1907",https://www.congress.gov/bill/107th-congress/senate-bill/1907,"107th Congress (2001-2002)",,"A bill to direct the Secretary of the Interior to convey certain land to the city of Haines, Oregon.","Sen. Smith, Gordon H. [R-OR]",01/29/2002,,,,1,"House - Resources | Senate - Energy and Natural Resources",12/04/2002,"Became Public Law No: 107-324."
"S. 1888",https://www.congress.gov/bill/107th-congress/senate-bill/1888,"107th Congress (2001-2002)",,"A bill to amend title 18 of the United States Code to correct a technical error in the codification of title 36 of the United States Code.","Sen. Stevens, Ted [R-AK]",12/20/2001,,,,4,"House - Judiciary",02/08/2002,"Became Public Law No: 107-140."
"S. 1857",https://www.congress.gov/bill/107th-congress/senate-bill/1857,"107th Congress (2001-2002)",,"A bill to Encourage the Negotiated Settlement of Tribal Claims.","Sen. Campbell, Ben Nighthorse [R-CO]",12/19/2001,,,,1,"Senate - Indian Affairs",03/19/2002,"Became Public Law No: 107-153."
"S. 1834",https://www.congress.gov/bill/107th-congress/senate-bill/1834,"107th Congress (2001-2002)",,"A bill for the relief of retired Sergeant First Class James D. Benoit and Wan Sook Benoit.","Sen. Levin, Carl [D-MI]",12/14/2001,,,,0,"House - Judiciary | Senate - Judiciary",10/01/2002,"Became Private Law No: 107-2."
"S. 1793",https://www.congress.gov/bill/107th-congress/senate-bill/1793,"107th Congress (2001-2002)",,"Higher Education Relief Opportunities for Students Act of 2001","Sen. Collins, Susan M. [R-ME]",12/10/2001,,,,17,"Senate - Health, Education, Labor, and Pensions",01/15/2002,"Became Public Law No: 107-122."
"S. 1789",https://www.congress.gov/bill/107th-congress/senate-bill/1789,"107th Congress (2001-2002)",,"Best Pharmaceuticals for Children Act","Sen. Dodd, Christopher J. [D-CT]",12/08/2001,,,,1,,01/04/2002,"Became Public Law No: 107-109."
"S. 1762",https://www.congress.gov/bill/107th-congress/senate-bill/1762,"107th Congress (2001-2002)",,"A bill to amend the Higher Education Act of 1965 to establish fixed interest rates for student and parent borrowers, to extend current law with respect to special allowances for lenders, and for other purposes.","Sen. Johnson, Tim [D-SD]",12/04/2001,,,,1,"Senate - Health, Education, Labor, and Pensions",02/08/2002,"Became Public Law No: 107-139."
"S. 1741",https://www.congress.gov/bill/107th-congress/senate-bill/1741,"107th Congress (2001-2002)",,"Native American Breast and Cervical Cancer Treatment Technical Amendment Act of 2001","Sen. Bingaman, Jeff [D-NM]",11/28/2001,,,,24,,01/15/2002,"Became Public Law No: 107-121."
"S. 1714",https://www.congress.gov/bill/107th-congress/senate-bill/1714,"107th Congress (2001-2002)",,"A bill to provide for the installation of a plaque to honor Dr. James Harvey Early in the Williamsburg, Kentucky Post Office Building.","Sen. McConnell, Mitch [R-KY]",11/15/2001,,,,0,"House - Government Reform | Senate - Governmental Affairs",01/15/2002,"Became Public Law No: 107-120."
"S. 1646",https://www.congress.gov/bill/107th-congress/senate-bill/1646,"107th Congress (2001-2002)",,"A bill to identify certain routes in the States of Texas, Oklahoma, Colorado, and New Mexico as part of the Ports-to-Plains Corridor, a high priority corridor on the National Highway System.","Sen. Bingaman, Jeff [D-NM]",11/07/2001,,,,5,"House - Transportation and Infrastructure | Senate - Environment and Public Works",10/29/2002,"Became Public Law No: 107-259."
"S. 1573",https://www.congress.gov/bill/107th-congress/senate-bill/1573,"107th Congress (2001-2002)",,"Afghan Women and Children Relief Act of 2001","Sen. Hutchison, Kay Bailey [R-TX]",10/25/2001,,,,12,"House - International Relations",12/12/2001,"Became Public Law No: 107-81."
"S. 1533",https://www.congress.gov/bill/107th-congress/senate-bill/1533,"107th Congress (2001-2002)",,"Health Care Safety Net Amendments of 2002","Sen. Kennedy, Edward M. [D-MA]",10/11/2001,,,,0,"Senate - Health, Education, Labor, and Pensions",10/26/2002,"Became Public Law No: 107-251."
"S. 1465",https://www.congress.gov/bill/107th-congress/senate-bill/1465,"107th Congress (2001-2002)",,"A bill to authorize the President to exercise waivers of foreign assistance restrictions with respect to Pakistan through September 30, 2003, and for other purposes.","Sen. Brownback, Sam [R-KS]",09/25/2001,,,,12,"House - International Relations | Senate - Foreign Relations",10/27/2001,"Became Public Law No: 107-57."
"S. 1459",https://www.congress.gov/bill/107th-congress/senate-bill/1459,"107th Congress (2001-2002)",,"A bill to designate the Federal building and United States courthouse located at 550 West Fort Street in Boise, Idaho, as the ""James A. McClure Federal Building and United States Courthouse"".","Sen. Crapo, Mike [R-ID]",09/25/2001,,,,1,"Senate - Environment and Public Works",12/12/2001,"Became Public Law No: 107-80."
"S. 1447",https://www.congress.gov/bill/107th-congress/senate-bill/1447,"107th Congress (2001-2002)",,"Aviation and Transportation Security Act","Sen. Hollings, Ernest F. [D-SC]",09/21/2001,,,,30,,11/19/2001,"Became Public Law No: 107-71."
"S. 1438",https://www.congress.gov/bill/107th-congress/senate-bill/1438,"107th Congress (2001-2002)",,"National Defense Authorization Act for Fiscal Year 2002","Sen. Levin, Carl [D-MI]",09/19/2001,,,,0,,12/28/2001,"Became Public Law No: 107-107."
"S. 1424",https://www.congress.gov/bill/107th-congress/senate-bill/1424,"107th Congress (2001-2002)",,"A bill to amend the Immigration and Nationality Act to provide permanent authority for the admission of ""S"" visa non-immigrants.","Sen. Kennedy, Edward M. [D-MA]",09/13/2001,,,,4,,10/01/2001,"Became Public Law No: 107-45."
"S. 1372",https://www.congress.gov/bill/107th-congress/senate-bill/1372,"107th Congress (2001-2002)",,"Export-Import Bank Reauthorization Act of 2002","Sen. Sarbanes, Paul S. [D-MD]",08/03/2001,,,,0,"Senate - Banking, Housing, and Urban Affairs",06/14/2002,"Became Public Law No: 107-189."
"S. 1339",https://www.congress.gov/bill/107th-congress/senate-bill/1339,"107th Congress (2001-2002)",,"Persian Gulf War POW/MIA Accountability Act of 2002","Sen. Campbell, Ben Nighthorse [R-CO]",08/02/2001,,,,43,"House - Judiciary, International Relations | Senate - Judiciary",10/29/2002,"Became Public Law No: 107-258."
"S. 1325",https://www.congress.gov/bill/107th-congress/senate-bill/1325,"107th Congress (2001-2002)",,"A bill to ratify an agreement between the Aleut Corporation and the United States of America to exchange land rights received under the Alaska Native Claims Settlement Act for certain land interests on Adak Island, and for other purposes.","Sen. Murkowski, Frank H. [R-AK]",08/02/2001,,,,0,"House - Resources, Armed Services | Senate - Energy and Natural Resources",10/11/2002,"Became Public Law No: 107-239."
"S. 1270",https://www.congress.gov/bill/107th-congress/senate-bill/1270,"107th Congress (2001-2002)",,"A bill to designate the United States courthouse to be constructed at 8th Avenue and Mill Street in Eugene, Oregon, as the ""Wayne Lyman Morse United States Courthouse"".","Sen. Wyden, Ron [D-OR]",07/30/2001,,,,1,"House - Transportation and Infrastructure | Senate - Environment and Public Works",10/29/2002,"Became Public Law No: 107-257."
"S. 1240",https://www.congress.gov/bill/107th-congress/senate-bill/1240,"107th Congress (2001-2002)",,"Timpanogos Interagency Land Exchange Act","Sen. Bennett, Robert F. [R-UT]",07/25/2001,,,,0,"House - Resources | Senate - Energy and Natural Resources",12/06/2002,"Became Public Law No: 107-329."
"S. 1227",https://www.congress.gov/bill/107th-congress/senate-bill/1227,"107th Congress (2001-2002)",,"Niagara Falls National Heritage Area Study Act","Sen. Schumer, Charles E. [D-NY]",07/24/2001,,,,1,"House - Resources | Senate - Energy and Natural Resources",10/29/2002,"Became Public Law No: 107-256."
"S. 1226",https://www.congress.gov/bill/107th-congress/senate-bill/1226,"107th Congress (2001-2002)",,"POW/MIA Memorial Flag Act of 2002","Sen. Campbell, Ben Nighthorse [R-CO]",07/24/2001,,,,19,"House - Resources | Senate - Judiciary",12/04/2002,"Became Public Law No: 107-323."
"S. 1214",https://www.congress.gov/bill/107th-congress/senate-bill/1214,"107th Congress (2001-2002)",,"Maritime Transportation Security Act of 2002 ","Sen. Hollings, Ernest F. [D-SC]",07/20/2001,,,,14,"Senate - Commerce, Science, and Transportation",11/25/2002,"Became Public Law No: 107-295."
"S. 1210",https://www.congress.gov/bill/107th-congress/senate-bill/1210,"107th Congress (2001-2002)",,"Native American Housing Assistance and Self-Determination Reauthorization Act of 2002","Sen. Campbell, Ben Nighthorse [R-CO]",07/20/2001,,,,12,"House - Financial Services | Senate - Indian Affairs, Banking, Housing, and Urban Affairs",11/13/2002,"Became Public Law No: 107-292."
"S. 1206",https://www.congress.gov/bill/107th-congress/senate-bill/1206,"107th Congress (2001-2002)",,"Appalachian Regional Development Act Amendments of 2002","Sen. Voinovich, George V. [R-OH]",07/19/2001,,,,8,"Senate - Environment and Public Works",03/12/2002,"Became Public Law No: 107-149."
"S. 1202",https://www.congress.gov/bill/107th-congress/senate-bill/1202,"107th Congress (2001-2002)",,"Office of Government Ethics Authorization Act of 2001","Sen. Lieberman, Joseph I. [D-CT]",07/19/2001,,,,1,"House - Government Reform, Judiciary | Senate - Governmental Affairs",01/15/2002,"Became Public Law No: 107-119."
"S. 1196",https://www.congress.gov/bill/107th-congress/senate-bill/1196,"107th Congress (2001-2002)",,"Small Business Investment Company Amendments Act of 2001","Sen. Bond, Christopher S. [R-MO]",07/18/2001,,,,1,"Senate - Small Business and Entrepreneurship",12/21/2001,"Became Public Law No: 107-100."
"S. 1190",https://www.congress.gov/bill/107th-congress/senate-bill/1190,"107th Congress (2001-2002)",,"A bill to amend the Internal Revenue Code of 1986 to rename  the education individual retirement accounts as the Coverdell education savings account.","Sen. Lott, Trent [R-MS]",07/18/2001,,,,1,"House - Ways and Means",07/26/2001,"Became Public Law No: 107-22."
"S. 1175",https://www.congress.gov/bill/107th-congress/senate-bill/1175,"107th Congress (2001-2002)",,"Vicksburg National Military Park Boundary Modification Act of 2002","Sen. Lott, Trent [R-MS]",07/12/2001,,,,1,"Senate - Energy and Natural Resources",10/11/2002,"Became Public Law No: 107-238."
"S. 1094",https://www.congress.gov/bill/107th-congress/senate-bill/1094,"107th Congress (2001-2002)",,"Hematological Cancer Research Investment and Education Act of 2002","Sen. Hutchison, Kay Bailey [R-TX]",06/22/2001,,,,6,"House - Energy and Commerce | Senate - Health, Education, Labor, and Pensions",05/14/2002,"Became Public Law No: 107-172."
"S. 1029",https://www.congress.gov/bill/107th-congress/senate-bill/1029,"107th Congress (2001-2002)",,"A bill to clarify the authority of the Department of Housing and Urban Development with respect to the use of fees during fiscal year 2001 for the manufactured housing program.","Sen. Sarbanes, Paul S. [D-MD]",06/13/2001,,,,10,,07/05/2001,"Became Public Law No: 107-18."
"S. 1026",https://www.congress.gov/bill/107th-congress/senate-bill/1026,"107th Congress (2001-2002)",,"A bill to designate the United States Post Office located at 60 Third Avenue in Long Branch, New Jersey, as the ""Pat King Post Office Building"".","Sen. Torricelli, Robert G. [D-NJ]",06/13/2001,,,,0,"House - Government Reform | Senate - Governmental Affairs",02/14/2002,"Became Public Law No: 107-146."
"S. 1010",https://www.congress.gov/bill/107th-congress/senate-bill/1010,"107th Congress (2001-2002)",,"A bill to extend the deadline for commencement of construction of a hydroelectric project in the State of North Carolina.","Sen. Helms, Jesse [R-NC]",06/11/2001,,,,1,"House - Energy and Commerce | Senate - Energy and Natural Resources",12/04/2002,"Became Public Law No: 107-322."
"S. 970",https://www.congress.gov/bill/107th-congress/senate-bill/970,"107th Congress (2001-2002)",,"A bill to designate the facility of the United States Postal Service located at 39 Tremont Street, Paris Hill, Maine, as the Horatio King Post Office Building.","Sen. Collins, Susan M. [R-ME]",05/25/2001,,,,1,"House - Government Reform | Senate - Governmental Affairs",02/14/2002,"Became Public Law No: 107-145."
"S. 737",https://www.congress.gov/bill/107th-congress/senate-bill/737,"107th Congress (2001-2002)",,"A bill to designate the facility of the United States Postal Service located at 811 South Main Street in Yerington, Nevada, as the ""Joseph E. Dini, Jr. Post Office"".","Sen. Reid, Harry [D-NV]",04/06/2001,,,,1,"House - Government Reform | Senate - Governmental Affairs",02/14/2002,"Became Public Law No: 107-144."
"S. 700",https://www.congress.gov/bill/107th-congress/senate-bill/700,"107th Congress (2001-2002)",,"Animal Disease Risk Assessment, Prevention, and Control Act of 2001","Sen. Campbell, Ben Nighthorse [R-CO]",04/04/2001,,,,3,,05/24/2001,"Became Public Law No: 107-9."
"S. 657",https://www.congress.gov/bill/107th-congress/senate-bill/657,"107th Congress (2001-2002)",,"A bill to authorize funding for the National 4-H Program Centennial Initiative.","Sen. Lugar, Richard G. [R-IN]",03/29/2001,,,,33,"House - Agriculture | Senate - Agriculture, Nutrition, and Forestry",07/10/2001,"Became Public Law No: 107-19."
"S. 560",https://www.congress.gov/bill/107th-congress/senate-bill/560,"107th Congress (2001-2002)",,"A bill for the relief of Rita Mirembe Revell (a.k.a. Margaret Rita Mirembe).","Sen. Hatch, Orrin G. [R-UT]",03/19/2001,,,,0,"House - Judiciary | Senate - Judiciary",07/17/2001,"Became Private Law No: 107-1."
"S. 494",https://www.congress.gov/bill/107th-congress/senate-bill/494,"107th Congress (2001-2002)",,"Zimbabwe Democracy and Economic Recovery Act of 2001
","Sen. Frist, William H. [R-TN]",03/08/2001,,,,4,"House - Financial Services, International Relations | Senate - Foreign Relations",12/21/2001,"Became Public Law No: 107-99."
"S. 468",https://www.congress.gov/bill/107th-congress/senate-bill/468,"107th Congress (2001-2002)",,"A bill to designate the Federal building located at 6230 Van Nuys Boulevard in Van Nuys, California, as the ""James C. Corman Federal Building"".","Sen. Feinstein, Dianne [D-CA]",03/06/2001,,,,1,"Senate - Environment and Public Works",08/03/2001,"Became Public Law No: 107-23."
"S. 378",https://www.congress.gov/bill/107th-congress/senate-bill/378,"107th Congress (2001-2002)",,"A bill to redesignate the Federal building located at 3348 South Kedzie Avenue, in Chicago, Illinois, as the ""Paul Simon Chicago Job Corps Center"".","Sen. Durbin, Richard J. [D-IL]",02/15/2001,,,,1,"House - Transportation and Infrastructure | Senate - Environment and Public Works",05/21/2002,"Became Public Law No: 107-182."
"S. 360",https://www.congress.gov/bill/107th-congress/senate-bill/360,"107th Congress (2001-2002)",,"A bill to honor Paul D. Coverdell.","Sen. Lott, Trent [R-MS]",02/15/2001,,,,52,"House - International Relations, Education and the Workforce",07/26/2001,"Became Public Law No: 107-21."
"S. 279",https://www.congress.gov/bill/107th-congress/senate-bill/279,"107th Congress (2001-2002)",,"A bill affecting the representation of the majority and minority membership of the Senate Members of the Joint Economic Committee.","Sen. Lott, Trent [R-MS]",02/07/2001,,,,1,,03/13/2001,"Became Public Law No: 107-3."
"S. 248",https://www.congress.gov/bill/107th-congress/senate-bill/248,"107th Congress (2001-2002)",,"A bill to amend the Admiral James W. Nance and Meg Donovan Foreign Relations Authorization Act, Fiscal Years 2000 and 2001, to adjust a condition on the payment of arrearages to the United Nations that sets the maximum share of any United Nations peacekeeping operation's budget that may be assessed of any  country.","Sen. Helms, Jesse [R-NC]",02/06/2001,,,,2,"House - International Relations | Senate - Foreign Relations",10/05/2001,"Became Public Law No: 107-46."
"S. 238",https://www.congress.gov/bill/107th-congress/senate-bill/238,"107th Congress (2001-2002)",,"Burnt, Malheur, Owyhee, and Powder River Basin Water Optimization Feasibility Study Act of 2001","Sen. Wyden, Ron [D-OR]",02/01/2001,,,,1,"House - Resources | Senate - Energy and Natural Resources",10/11/2002,"Became Public Law No: 107-237."
"S.J.Res. 53",https://www.congress.gov/bill/107th-congress/senate-joint-resolution/53,"107th Congress (2001-2002)",,"A joint resolution relative to the convening of the first session of the One Hundred Eighth Congress.","Sen. Daschle, Thomas A. [D-SD]",11/14/2002,,,,1,,12/04/2002,"Became Public Law No: 107-328."
"S.J.Res. 32",https://www.congress.gov/bill/107th-congress/senate-joint-resolution/32,"107th Congress (2001-2002)",,"A joint resolution congratulating the United States Military Academy at West Point on its bicentennial anniversary, and commending its outstanding contributions to the Nation.","Sen. Reed, Jack [D-RI]",02/25/2002,,,,25,"House - Armed Services",03/14/2002,"Became Public Law No: 107-152."
"S.J.Res. 26",https://www.congress.gov/bill/107th-congress/senate-joint-resolution/26,"107th Congress (2001-2002)",,"A joint resolution providing for the appointment of Patricia Q. Stonesifer as a citizen regent of the Board of Regents of the Smithsonian Institution.","Sen. Cochran, Thad [R-MS]",10/17/2001,,,,2,"House - House Administration | Senate - Rules and Administration",12/21/2001,"Became Public Law No: 107-101."
"S.J.Res. 23",https://www.congress.gov/bill/107th-congress/senate-joint-resolution/23,"107th Congress (2001-2002)",,"Authorization for Use of Military Force","Sen. Daschle, Thomas A. [D-SD]",09/14/2001,,,,1,,09/18/2001,"Became Public Law No: 107-40."
"S.J.Res. 22",https://www.congress.gov/bill/107th-congress/senate-joint-resolution/22,"107th Congress (2001-2002)",,"A joint resolution expressing the sense of the Senate and House of Representatives regarding the terrorist attacks launched against the Unites States on September 11, 2001.","Sen. Daschle, Thomas A. [D-SD]",09/12/2001,,,,99,,09/18/2001,"Became Public Law No: 107-39."
"S.J.Res. 20",https://www.congress.gov/bill/107th-congress/senate-joint-resolution/20,"107th Congress (2001-2002)",,"A joint resolution providing for the appointment of Roger W. Sant as a citizen regent of the Board of Regents of the Smithsonian Institution.","Sen. Cochran, Thad [R-MS]",07/12/2001,,,,2,"House - House Administration | Senate - Rules and Administration",10/24/2001,"Became Public Law No: 107-55."
"S.J.Res. 19",https://www.congress.gov/bill/107th-congress/senate-joint-resolution/19,"107th Congress (2001-2002)",,"A joint resolution providing for the reappointment of Anne d'Harnoncourt as a citizen regent of the Board of Regents of the Smithsonian Institution.","Sen. Cochran, Thad [R-MS]",07/12/2001,,,,2,"House - House Administration | Senate - Rules and Administration",10/24/2001,"Became Public Law No: 107-54."
"S.J.Res. 13",https://www.congress.gov/bill/107th-congress/senate-joint-resolution/13,"107th Congress (2001-2002)",,"A joint resolution conferring honorary citizenship of the United States posthumously on Marie Joseph Paul Yves Roche Gilbert du Motier, the Marquis de Lafayette.","Sen. Warner, John [R-VA]",04/24/2001,,,,10,"House - Judiciary | Senate - Judiciary",08/06/2002,"Became Public Law No: 107-209."
"S.J.Res. 6",https://www.congress.gov/bill/107th-congress/senate-joint-resolution/6,"107th Congress (2001-2002)",,"A joint resolution providing for congressional disapproval of the rule submitted by the Department of Labor under chapter 8 of title 5, United States Code, relating to ergonomics.","Sen. Nickles, Don [R-OK]",03/01/2001,,,,6,"Senate - Health, Education, Labor, and Pensions",03/20/2001,"Became Public Law No: 107-5."
"S. 3239",https://www.congress.gov/bill/106th-congress/senate-bill/3239,"106th Congress (1999-2000)",,"A bill to amend the Immigration and Nationality Act to provide special immigrant status for certain United States international broadcasting employees.","Sen. Helms, Jesse [R-NC]",10/25/2000,,,,1,"House - Judiciary",11/22/2000,"Became Public Law No: 106-536."
"S. 3201",https://www.congress.gov/bill/106th-congress/senate-bill/3201,"106th Congress (1999-2000)",,"A bill to rename the National Museum of American Art.","Sen. Frist, William H. [R-TN]",10/12/2000,,,,2,,10/27/2000,"Became Public Law No: 106-385."
"S. 3194",https://www.congress.gov/bill/106th-congress/senate-bill/3194,"106th Congress (1999-2000)",,"A bill to designate the facility of the United States Postal Service located at 431 George Street in Millersville, Pennsylvania, as the ""Robert S. Walker Post Office"".","Sen. Santorum, Rick [R-PA]",10/12/2000,,,,1,"House - Government Reform | Senate - Governmental Affairs",11/22/2000,"Became Public Law No: 106-535."
"S. 3181",https://www.congress.gov/bill/106th-congress/senate-bill/3181,"106th Congress (1999-2000)",,"National Moment of Remembrance Act","Sen. Hagel, Chuck [R-NE]",10/10/2000,,,,21,"Senate - Judiciary",12/28/2000,"Became Public Law No: 106-579."
"S. 3164",https://www.congress.gov/bill/106th-congress/senate-bill/3164,"106th Congress (1999-2000)",,"Protecting Seniors From Fraud Act","Sen. Bayh, Evan [D-IN]",10/05/2000,,,,4,"House - Judiciary, Commerce | Senate - Judiciary",11/22/2000,"Became Public Law No: 106-534."
"S. 3137",https://www.congress.gov/bill/106th-congress/senate-bill/3137,"106th Congress (1999-2000)",,"James Madison Commemoration Commission Act","Sen. Sessions, Jeff [R-AL]",09/28/2000,,,,39,"House - Government Reform",12/19/2000,"Became Public Law No: 106-550."
"S. 3062",https://www.congress.gov/bill/106th-congress/senate-bill/3062,"106th Congress (1999-2000)",,"A bill to modify the date on which the Mayor of the District of Columbia submits a performance accountability plan to Congress, and for other purposes.","Sen. Voinovich, George V. [R-OH]",09/18/2000,,,,1,"House - Government Reform | Senate - Governmental Affairs",11/06/2000,"Became Public Law No: 106-449."
"S. 3045",https://www.congress.gov/bill/106th-congress/senate-bill/3045,"106th Congress (1999-2000)",,"Paul Coverdell National Forensic Sciences Improvement Act of 2000","Sen. Sessions, Jeff [R-AL]",09/14/2000,,,,32,"House - Judiciary | Senate - Judiciary",12/21/2000,"Became Public Law No: 106-561."
"S. 3022",https://www.congress.gov/bill/106th-congress/senate-bill/3022,"106th Congress (1999-2000)",,"Nampa and Meridian Conveyance Act","Sen. Craig, Larry E. [R-ID]",09/08/2000,,,,1,"Senate - Energy and Natural Resources",11/07/2000,"Became Public Law No: 106-466."
