"S. 2339",https://www.congress.gov/bill/110th-congress/senate-bill/2339,"110th Congress (2007-2008)",,"A bill to designate the Department of Veterans Affairs clinic in Alpena, Michigan, as the ""Lieutenant Colonel Clement C. Van Wagoner Department of Veterans Affairs Clinic"".","Sen. Stabenow, Debbie [D-MI]",11/13/2007,,,,1,"House - Veterans' Affairs | Senate - Veterans' Affairs",09/30/2008,"Became Public Law No: 110-332."
"S. 2304",https://www.congress.gov/bill/110th-congress/senate-bill/2304,"110th Congress (2007-2008)",,"Mentally Ill Offender Treatment and Crime Reduction Reauthorization and Improvement Act of 2008","Sen. Domenici, Pete V. [R-NM]",11/05/2007,,,,5,"Senate - Judiciary",10/14/2008,"Became Public Law No: 110-416."
"S. 2272",https://www.congress.gov/bill/110th-congress/senate-bill/2272,"110th Congress (2007-2008)",,"A bill to designate the facility of the United States Postal Service known as the Southpark Station in Alexandria, Louisiana, as the John ""Marty"" Thiels Southpark Station, in honor and memory of Thiels, a Louisiana postal worker who was killed in the line of duty on October 4, 2007.","Sen. Vitter, David [R-LA]",10/31/2007,,,,1,"House - Oversight and Government Reform | Senate - Homeland Security and Governmental Affairs",03/12/2008,"Became Public Law No: 110-195."
"S. 2271",https://www.congress.gov/bill/110th-congress/senate-bill/2271,"110th Congress (2007-2008)",,"Sudan Accountability and Divestment Act of 2007","Sen. Dodd, Christopher J. [D-CT]",10/31/2007,,,,0,"House - Financial Services, Oversight and Government Reform, Foreign Affairs, Education and Labor | Senate - Banking, Housing, and Urban Affairs",12/31/2007,"Became Public Law No: 110-174."
"S. 2258",https://www.congress.gov/bill/110th-congress/senate-bill/2258,"110th Congress (2007-2008)",,"Third Higher Education Extension Act of 2007","Sen. Kennedy, Edward M. [D-MA]",10/30/2007,,,,0,,10/31/2007,"Became Public Law No: 110-109."
"S. 2206",https://www.congress.gov/bill/110th-congress/senate-bill/2206,"110th Congress (2007-2008)",,"A bill to provide technical corrections to Public Law 109-116 (2 U.S.C. 2131a note) to extend the time period for the Joint Committee on the Library to enter into an agreement to obtain a statue of Rosa Parks, and for other purposes.","Sen. Feinstein, Dianne [D-CA]",10/18/2007,,,,7,"House - House Administration",11/19/2007,"Became Public Law No: 110-120."
"S. 2174",https://www.congress.gov/bill/110th-congress/senate-bill/2174,"110th Congress (2007-2008)",,"A bill to designate the facility of the United States Postal Service located at 175 South Monroe Street in Tiffin, Ohio, as the ""Paul E. Gillmor Post Office Building"".","Sen. Voinovich, George V. [R-OH]",10/17/2007,,,,1,"House - Oversight and Government Reform | Senate - Homeland Security and Governmental Affairs",12/21/2007,"Became Public Law No: 110-152."
"S. 2162",https://www.congress.gov/bill/110th-congress/senate-bill/2162,"110th Congress (2007-2008)",,"Veterans' Mental Health and Other Care Improvements Act of 2008","Sen. Akaka, Daniel K. [D-HI]",10/15/2007,,,,12,"House - Veterans' Affairs | Senate - Veterans' Affairs",10/10/2008,"Became Public Law No: 110-387."
"S. 2146",https://www.congress.gov/bill/110th-congress/senate-bill/2146,"110th Congress (2007-2008)",,"A bill to authorize the Administrator of the Environmental Protection Agency to accept, as part of a settlement, diesel emission reduction Supplemental Environmental Projects, and for other purposes.","Sen. Carper, Thomas R. [D-DE]",10/04/2007,,,,5,"House - Energy and Commerce | Senate - Environment and Public Works",06/30/2008,"Became Public Law No: 110-255."
"S. 2135",https://www.congress.gov/bill/110th-congress/senate-bill/2135,"110th Congress (2007-2008)",,"Child Soldiers Accountability Act of 2008","Sen. Durbin, Richard J. [D-IL]",10/03/2007,,,,9,"House - Judiciary | Senate - Judiciary",10/03/2008,"Became Public Law No: 110-340."
"S. 2110",https://www.congress.gov/bill/110th-congress/senate-bill/2110,"110th Congress (2007-2008)",,"A bill to designate the facility of the United States Postal Service located at 427 North Street in Taft, California, as the ""Larry S. Pierce Post Office"".","Sen. Feinstein, Dianne [D-CA]",09/27/2007,,,,1,"House - Oversight and Government Reform | Senate - Homeland Security and Governmental Affairs",02/06/2008,"Became Public Law No: 110-184."
"S. 2106",https://www.congress.gov/bill/110th-congress/senate-bill/2106,"110th Congress (2007-2008)",,"Procedural Fairness for September 11 Victims Act of 2007","Sen. Biden, Joseph R., Jr. [D-DE]",09/27/2007,,,,7,"House - Judiciary | Senate - Judiciary",11/08/2007,"Became Public Law No: 110-113."
"S. 1983",https://www.congress.gov/bill/110th-congress/senate-bill/1983,"110th Congress (2007-2008)",,"Pesticide Registration Improvement Renewal Act","Sen. Harkin, Tom [D-IA]",08/02/2007,,,,1,"House - Agriculture",10/09/2007,"Became Public Law No: 110-94."
"S. 1927",https://www.congress.gov/bill/110th-congress/senate-bill/1927,"110th Congress (2007-2008)",,"Protect America Act of 2007","Sen. McConnell, Mitch [R-KY]",08/01/2007,,,,1,,08/05/2007,"Became Public Law No: 110-55."
"S. 1916",https://www.congress.gov/bill/110th-congress/senate-bill/1916,"110th Congress (2007-2008)",,"Chimp Haven is Home Act","Sen. Burr, Richard [R-NC]",08/01/2007,,,,3,"House - Energy and Commerce | Senate - Health, Education, Labor, and Pensions",12/26/2007,"Became Public Law No: 110-170."
"S. 1896",https://www.congress.gov/bill/110th-congress/senate-bill/1896,"110th Congress (2007-2008)",,"A bill to designate the facility of the United States Postal Service located at 11 Central Street in Hillsborough, New Hampshire, as the ""Officer Jeremy Todd Charron Post Office"".","Sen. Sununu, John E. [R-NH]",07/30/2007,,,,1,"House - Oversight and Government Reform | Senate - Homeland Security and Governmental Affairs",12/26/2007,"Became Public Law No: 110-169."
"S. 1868",https://www.congress.gov/bill/110th-congress/senate-bill/1868,"110th Congress (2007-2008)",,"Second Higher Education Extension Act of 2007","Sen. Kennedy, Edward M. [D-MA]",07/24/2007,,,,1,,07/31/2007,"Became Public Law No: 110-51."
"S. 1858",https://www.congress.gov/bill/110th-congress/senate-bill/1858,"110th Congress (2007-2008)",,"Newborn Screening Saves Lives Act of 2007","Sen. Dodd, Christopher J. [D-CT]",07/23/2007,,,,21,"House - Energy and Commerce | Senate - Health, Education, Labor, and Pensions",04/24/2008,"Became Public Law No: 110-204."
"S. 1810",https://www.congress.gov/bill/110th-congress/senate-bill/1810,"110th Congress (2007-2008)",,"Prenatally and Postnatally Diagnosed Conditions Awareness Act","Sen. Brownback, Sam [R-KS]",07/18/2007,,,,6,"House - Energy and Commerce | Senate - Health, Education, Labor, and Pensions",10/08/2008,"Became Public Law No: 110-374."
"S. 1760",https://www.congress.gov/bill/110th-congress/senate-bill/1760,"110th Congress (2007-2008)",,"Healthy Start Reauthorization Act of 2007","Sen. Brown, Sherrod [D-OH]",07/10/2007,,,,18,"House - Energy and Commerce | Senate - Health, Education, Labor, and Pensions",10/03/2008,"Became Public Law No: 110-339."
"S. 1738",https://www.congress.gov/bill/110th-congress/senate-bill/1738,"110th Congress (2007-2008)",,"PROTECT Our Children Act of 2008","Sen. Biden, Joseph R., Jr. [D-DE]",06/28/2007,,,,60,"Senate - Judiciary",10/13/2008,"Became Public Law No: 110-401."
"S. 1716",https://www.congress.gov/bill/110th-congress/senate-bill/1716,"110th Congress (2007-2008)",,"A bill to amend the U.S. Troop Readiness, Veterans' Care, Katrina Recovery and Iraq Accountability Appropriations Act, 2007, to strike a requirement relating to forage producers.","Sen. Thune, John [R-SD]",06/27/2007,,,,12,"Senate - Agriculture, Nutrition, and Forestry",08/13/2007,"Became Public Law No: 110-80."
"S. 1704",https://www.congress.gov/bill/110th-congress/senate-bill/1704,"110th Congress (2007-2008)",,"First Higher Education Extension Act of 2007","Sen. Kennedy, Edward M. [D-MA]",06/27/2007,,,,1,,07/03/2007,"Became Public Law No: 110-44."
"S. 1701",https://www.congress.gov/bill/110th-congress/senate-bill/1701,"110th Congress (2007-2008)",,"A bill to provide for the extension of transitional medical assistance (TMA) and the abstinence education program through the end of fiscal year 2007, and for other purposes.","Sen. Baucus, Max [D-MT]",06/27/2007,,,,1,,07/18/2007,"Became Public Law No: 110-48."
"S. 1692",https://www.congress.gov/bill/110th-congress/senate-bill/1692,"110th Congress (2007-2008)",,"A bill to grant a Federal charter to Korean War Veterans Association, Incorporated.","Sen. Cardin, Benjamin L. [D-MD]",06/25/2007,,,,11,"Senate - Judiciary",06/30/2008,"Became Public Law No: 110-254."
"S. 1612",https://www.congress.gov/bill/110th-congress/senate-bill/1612,"110th Congress (2007-2008)",,"International Emergency Economic Powers Enhancement Act","Sen. Dodd, Christopher J. [D-CT]",06/13/2007,,,,0,"House - Foreign Affairs | Senate - Banking, Housing, and Urban Affairs",10/16/2007,"Became Public Law No: 110-96."
"S. 1582",https://www.congress.gov/bill/110th-congress/senate-bill/1582,"110th Congress (2007-2008)",,"Hydrographic Services Improvement Act Amendments of 2008","Sen. Inouye, Daniel K. [D-HI]",06/07/2007,,,,3,"Senate - Commerce, Science, and Transportation",10/10/2008,"Became Public Law No: 110-386."
"S. 1537",https://www.congress.gov/bill/110th-congress/senate-bill/1537,"110th Congress (2007-2008)",,"A bill to authorize the transfer of certain funds from the Senate Gift Shop Revolving Fund to the Senate Employee Child Care Center.","Sen. Landrieu, Mary L. [D-LA]",05/25/2007,,,,1,,06/21/2007,"Became Public Law No: 110-39."
"S. 1492",https://www.congress.gov/bill/110th-congress/senate-bill/1492,"110th Congress (2007-2008)",,"Broadband Data Improvement Act","Sen. Inouye, Daniel K. [D-HI]",05/24/2007,,,,22,"House - Energy and Commerce | Senate - Commerce, Science, and Transportation",10/10/2008,"Became Public Law No: 110-385."
"S. 1396",https://www.congress.gov/bill/110th-congress/senate-bill/1396,"110th Congress (2007-2008)",,"A bill to authorize a major medical facility project to modernize inpatient wards at the Department of Veterans Affairs Medical Center in Atlanta, Georgia.","Sen. Isakson, Johnny [R-GA]",05/15/2007,,,,0,"House - Veterans' Affairs | Senate - Veterans' Affairs",12/26/2007,"Became Public Law No: 110-168."
"S. 1382",https://www.congress.gov/bill/110th-congress/senate-bill/1382,"110th Congress (2007-2008)",,"ALS Registry Act","Sen. Reid, Harry [D-NV]",05/14/2007,,,,77,"Senate - Health, Education, Labor, and Pensions",10/08/2008,"Became Public Law No: 110-373."
"S. 1352",https://www.congress.gov/bill/110th-congress/senate-bill/1352,"110th Congress (2007-2008)",,"A bill to designate the facility of the United States Postal Service located at 127 East Locust Street in Fairbury, Illinois, as the ""Dr. Francis Townsend Post Office Building"".","Sen. Durbin, Richard J. [D-IL]",05/10/2007,,,,1,"House - Oversight and Government Reform | Senate - Homeland Security and Governmental Affairs",07/03/2007,"Became Public Law No: 110-43."
"S. 1276",https://www.congress.gov/bill/110th-congress/senate-bill/1276,"110th Congress (2007-2008)",,"Methamphetamine Production Prevention Act of 2008","Sen. Durbin, Richard J. [D-IL]",05/03/2007,,,,14,"House - Energy and Commerce, Judiciary | Senate - Judiciary",10/14/2008,"Became Public Law No: 110-415."
"S. 1245",https://www.congress.gov/bill/110th-congress/senate-bill/1245,"110th Congress (2007-2008)",,"A bill to reform mutual aid agreements for the National Capital Region.","Sen. Cardin, Benjamin L. [D-MD]",04/26/2007,,,,3,"Senate - Homeland Security and Governmental Affairs",06/26/2008,"Became Public Law No: 110-250."
"S. 1193",https://www.congress.gov/bill/110th-congress/senate-bill/1193,"110th Congress (2007-2008)",,"Albuquerque Indian School Act","Sen. Domenici, Pete V. [R-NM]",04/24/2007,,,,1,"House - Natural Resources | Senate - Indian Affairs",12/02/2008,"Became Public Law No: 110-453."
"S. 1104",https://www.congress.gov/bill/110th-congress/senate-bill/1104,"110th Congress (2007-2008)",,"A bill to increase the number of Iraqi and Afghani translators and interpreters who may be admitted to the United States as special immigrants, and for other purposes.","Sen. Lugar, Richard G. [R-IN]",04/12/2007,,,,11,"House - Judiciary",06/15/2007,"Became Public Law No: 110-36."
"S. 1099",https://www.congress.gov/bill/110th-congress/senate-bill/1099,"110th Congress (2007-2008)",,"A bill to amend chapter 89 of title 5, United States Code, to make individuals employed by the Roosevelt Campobello International Park Commission eligible to obtain Federal health insurance.","Sen. Collins, Susan M. [R-ME]",04/12/2007,,,,2,"House - Oversight and Government Reform | Senate - Homeland Security and Governmental Affairs",08/09/2007,"Became Public Law No: 110-74."
"S. 1046",https://www.congress.gov/bill/110th-congress/senate-bill/1046,"110th Congress (2007-2008)",,"Senior Professional Performance Act of 2008","Sen. Voinovich, George V. [R-OH]",03/29/2007,,,,0,"House - Oversight and Government Reform | Senate - Homeland Security and Governmental Affairs",10/08/2008,"Became Public Law No: 110-372."
"S. 1002",https://www.congress.gov/bill/110th-congress/senate-bill/1002,"110th Congress (2007-2008)",,"Older Americans Reauthorization Technical Corrections Act","Sen. Kennedy, Edward M. [D-MA]",03/27/2007,,,,2,"House - Education and Labor",04/23/2007,"Became Public Law No: 110-19."
"S. 996",https://www.congress.gov/bill/110th-congress/senate-bill/996,"110th Congress (2007-2008)",,"A bill to amend title 49, United States Code, to expand passenger facility fee eligibility for certain noise compatibility projects.","Sen. Feinstein, Dianne [D-CA]",03/27/2007,,,,1,"House - Transportation and Infrastructure | Senate - Commerce, Science, and Transportation",10/02/2008,"Became Public Law No: 110-337."
"S. 975",https://www.congress.gov/bill/110th-congress/senate-bill/975,"110th Congress (2007-2008)",,"A bill granting the consent and approval of Congress to an interstate forest fire protection compact.","Sen. Thune, John [R-SD]",03/23/2007,,,,5,"House - Judiciary | Senate - Judiciary",08/13/2007,"Became Public Law No: 110-79."
"S. 966",https://www.congress.gov/bill/110th-congress/senate-bill/966,"110th Congress (2007-2008)",,"Passport Backlog Reduction Act of 2007","Sen. Schumer, Charles E. [D-NY]",03/22/2007,,,,3,"House - Foreign Affairs | Senate - Foreign Relations",07/30/2007,"Became Public Law No: 110-50."
"S. 906",https://www.congress.gov/bill/110th-congress/senate-bill/906,"110th Congress (2007-2008)",,"Mercury Export Ban Act of 2008","Sen. Obama, Barack [D-IL]",03/15/2007,,,,5,"Senate - Environment and Public Works",10/14/2008,"Became Public Law No: 110-414."
"S. 888",https://www.congress.gov/bill/110th-congress/senate-bill/888,"110th Congress (2007-2008)",,"Genocide Accountability Act of 2007","Sen. Durbin, Richard J. [D-IL]",03/15/2007,,,,5,"House - Judiciary | Senate - Judiciary",12/21/2007,"Became Public Law No: 110-151."
"S. 863",https://www.congress.gov/bill/110th-congress/senate-bill/863,"110th Congress (2007-2008)",,"Emergency and Disaster Assistance Fraud Penalty Enhancement Act of 2007","Sen. Sessions, Jeff [R-AL]",03/13/2007,,,,5,"House - Judiciary | Senate - Judiciary",01/07/2008,"Became Public Law No: 110-179."
"S. 845",https://www.congress.gov/bill/110th-congress/senate-bill/845,"110th Congress (2007-2008)",,"Safety of Seniors Act of 2007","Sen. Enzi, Michael B. [R-WY]",03/12/2007,,,,4,"House - Energy and Commerce | Senate - Health, Education, Labor, and Pensions",04/23/2008,"Became Public Law No: 110-202."
"S. 801",https://www.congress.gov/bill/110th-congress/senate-bill/801,"110th Congress (2007-2008)",,"A bill to designate a United States courthouse located in Fresno, California, as the ""Robert E. Coyle United States Courthouse"".","Sen. Boxer, Barbara [D-CA]",03/07/2007,,,,1,"House - Transportation and Infrastructure | Senate - Environment and Public Works",07/05/2007,"Became Public Law No: 110-46."
"S. 793",https://www.congress.gov/bill/110th-congress/senate-bill/793,"110th Congress (2007-2008)",,"Traumatic Brain Injury Act of 2008","Sen. Hatch, Orrin G. [R-UT]",03/07/2007,,,,20,"House - Energy and Commerce | Senate - Health, Education, Labor, and Pensions",04/28/2008,"Became Public Law No: 110-206."
"S. 781",https://www.congress.gov/bill/110th-congress/senate-bill/781,"110th Congress (2007-2008)",,"Do-Not-Call Registry Fee Extension Act of 2007","Sen. Pryor, Mark L. [D-AR]",03/06/2007,,,,2,"Senate - Commerce, Science, and Transportation",02/15/2008,"Became Public Law No: 110-188."
"S. 682",https://www.congress.gov/bill/110th-congress/senate-bill/682,"110th Congress (2007-2008)",,"Edward William Brooke III Congressional Gold Medal Act","Sen. Kennedy, Edward M. [D-MA]",02/17/2007,,,,68,"House - Financial Services | Senate - Banking, Housing, and Urban Affairs",07/01/2008,"Became Public Law No: 110-260."
"S. 676",https://www.congress.gov/bill/110th-congress/senate-bill/676,"110th Congress (2007-2008)",,"A bill to provide that the Executive Director of the Inter-American Development Bank or the Alternate Executive Director of the Inter-American Development Bank may serve on the Board of Directors of the Inter-American Foundation.","Sen. Biden, Joseph R., Jr. [D-DE]",02/17/2007,,,,2,"House - Foreign Affairs | Senate - Foreign Relations",06/21/2007,"Became Public Law No: 110-38."
"S. 602",https://www.congress.gov/bill/110th-congress/senate-bill/602,"110th Congress (2007-2008)",,"Child Safe Viewing Act of 2007","Sen. Pryor, Mark L. [D-AR]",02/15/2007,,,,6,"House - Energy and Commerce | Senate - Commerce, Science, and Transportation",12/02/2008,"Became Public Law No: 110-452."
"S. 597",https://www.congress.gov/bill/110th-congress/senate-bill/597,"110th Congress (2007-2008)",,"A bill to amend title 39, United States Code, to extend the authority of the United States Postal Service to issue a semipostal to raise funds for breast cancer research.","Sen. Feinstein, Dianne [D-CA]",02/14/2007,,,,62,"Senate - Homeland Security and Governmental Affairs",12/21/2007,"Became Public Law No: 110-150."
"S. 550",https://www.congress.gov/bill/110th-congress/senate-bill/550,"110th Congress (2007-2008)",,"A bill to preserve existing judgeships on the Superior Court of the District of Columbia.","Sen. Akaka, Daniel K. [D-HI]",02/12/2007,,,,2,"House - Oversight and Government Reform | Senate - Homeland Security and Governmental Affairs",04/18/2008,"Became Public Law No: 110-201."
"S. 521",https://www.congress.gov/bill/110th-congress/senate-bill/521,"110th Congress (2007-2008)",,"A bill to designate the Federal building and United States courthouse and customhouse located at 515 West First Street in Duluth, Minnesota, as the ""Gerald W. Heaney Federal Building and United States Courthouse and Customhouse"".","Sen. Klobuchar, Amy [D-MN]",02/07/2007,,,,0,"Senate - Environment and Public Works",05/08/2007,"Became Public Law No: 110-25."
"S. 496",https://www.congress.gov/bill/110th-congress/senate-bill/496,"110th Congress (2007-2008)",,"Appalachian Regional Development Act Amendments of 2008","Sen. Voinovich, George V. [R-OH]",02/06/2007,,,,18,"Senate - Environment and Public Works",10/08/2008,"Became Public Law No: 110-371."
"S. 494",https://www.congress.gov/bill/110th-congress/senate-bill/494,"110th Congress (2007-2008)",,"NATO Freedom Consolidation Act of 2007","Sen. Lugar, Richard G. [R-IN]",02/06/2007,,,,7,"Senate - Foreign Relations",04/09/2007,"Became Public Law No: 110-17."
"S. 474",https://www.congress.gov/bill/110th-congress/senate-bill/474,"110th Congress (2007-2008)",,"A bill to award a congressional gold medal to Michael Ellis DeBakey, M.D.","Sen. Hutchison, Kay Bailey [R-TX]",02/01/2007,,,,71,"House - Financial Services | Senate - Banking, Housing, and Urban Affairs",10/16/2007,"Became Public Law No: 110-95."
"S. 431",https://www.congress.gov/bill/110th-congress/senate-bill/431,"110th Congress (2007-2008)",,"KIDS Act of 2008","Sen. Schumer, Charles E. [D-NY]",01/30/2007,,,,20,"Senate - Judiciary",10/13/2008,"Became Public Law No: 110-400."
"S. 377",https://www.congress.gov/bill/110th-congress/senate-bill/377,"110th Congress (2007-2008)",,"United States-Poland Parliamentary Youth Exchange Program Act of 2007","Sen. Lugar, Richard G. [R-IN]",01/24/2007,,,,3,"House - Foreign Affairs | Senate - Foreign Relations",09/20/2007,"Became Public Law No: 110-83."
"S. 375",https://www.congress.gov/bill/110th-congress/senate-bill/375,"110th Congress (2007-2008)",,"A bill to waive application of the Indian Self-Determination and Education Assistance Act to a specific parcel of real property transferred by the United States to 2 Indian tribes in the State of Oregon, and for other purposes.","Sen. Smith, Gordon H. [R-OR]",01/24/2007,,,,1,"House - Natural Resources | Senate - Indian Affairs",08/13/2007,"Became Public Law No: 110-78."
"S. 277",https://www.congress.gov/bill/110th-congress/senate-bill/277,"110th Congress (2007-2008)",,"Grand Teton National Park Extension Act of 2007","Sen. Thomas, Craig [R-WY]",01/12/2007,,,,1,"House - Natural Resources | Senate - Energy and Natural Resources",07/13/2007,"Became Public Law No: 110-47."
"S. 254",https://www.congress.gov/bill/110th-congress/senate-bill/254,"110th Congress (2007-2008)",,"A bill to award posthumously a Congressional gold medal to Constantino Brumidi.","Sen. Enzi, Michael B. [R-WY]",01/10/2007,,,,99,"House - Financial Services | Senate - Banking, Housing, and Urban Affairs",07/01/2008,"Became Public Law No: 110-259."
"S. 231",https://www.congress.gov/bill/110th-congress/senate-bill/231,"110th Congress (2007-2008)",,"A bill to authorize the Edward Byrne Memorial Justice Assistance Grant Program at fiscal year 2006 levels through 2012.","Sen. Feinstein, Dianne [D-CA]",01/09/2007,,,,52,"House - Judiciary | Senate - Judiciary",07/30/2008,"Became Public Law No: 110-294."
"S. 229",https://www.congress.gov/bill/110th-congress/senate-bill/229,"110th Congress (2007-2008)",,"A bill to redesignate a Federal building in Albuquerque, New Mexico, as the ""Raymond G. Murphy Department of Veterans Affairs Medical Center"".","Sen. Domenici, Pete V. [R-NM]",01/09/2007,,,,1,"House - Veterans' Affairs | Senate - Veterans' Affairs",07/05/2007,"Became Public Law No: 110-45."
"S. 214",https://www.congress.gov/bill/110th-congress/senate-bill/214,"110th Congress (2007-2008)",,"Preserving United States Attorney Independence Act of 2007","Sen. Feinstein, Dianne [D-CA]",01/09/2007,,,,16,"Senate - Judiciary",06/14/2007,"Became Public Law No: 110-34."
"S. 188",https://www.congress.gov/bill/110th-congress/senate-bill/188,"110th Congress (2007-2008)",,"A bill to revise the short title of the Fannie Lou Hamer, Rosa Parks, and Coretta Scott King Voting Rights Act Reauthorization and Amendments Act of 2006.","Sen. Salazar, Ken [D-CO]",01/04/2007,,,,5,"House - Judiciary | Senate - Judiciary",07/01/2008,"Became Public Law No: 110-258."
"S. 171",https://www.congress.gov/bill/110th-congress/senate-bill/171,"110th Congress (2007-2008)",,"A bill to designate the facility of the United States Postal Service located at 301 Commerce Street in Commerce, Oklahoma, as the ""Mickey Mantle Post Office Building"".","Sen. Inhofe, James M. [R-OK]",01/04/2007,,,,1,"House - Oversight and Government Reform | Senate - Homeland Security and Governmental Affairs",09/30/2008,"Became Public Law No: 110-331."
"S. 159",https://www.congress.gov/bill/110th-congress/senate-bill/159,"110th Congress (2007-2008)",,"A bill to redesignate the White Rocks National Recreation Area in the State of Vermont as the ""Robert T. Stafford White Rocks National Recreation Area"".","Sen. Leahy, Patrick J. [D-VT]",01/04/2007,,,,1,"House - Natural Resources",01/17/2007,"Became Public Law No: 110-1."
"S. 1",https://www.congress.gov/bill/110th-congress/senate-bill/1,"110th Congress (2007-2008)",,"Honest Leadership and Open Government Act of 2007","Sen. Reid, Harry [D-NV]",01/04/2007,,,,17,,09/14/2007,"Became Public Law No: 110-81."
"S.J.Res. 46",https://www.congress.gov/bill/110th-congress/senate-joint-resolution/46,"110th Congress (2007-2008)",,"A joint resolution ensuring that the compensation and other emoluments attached to the office of Secretary of State are those which were in effect on January 1, 2007.","Sen. Reid, Harry [D-NV]",12/10/2008,,,,0,,12/19/2008,"Became Public Law No: 110-455."
"S.J.Res. 45",https://www.congress.gov/bill/110th-congress/senate-joint-resolution/45,"110th Congress (2007-2008)",,"Great Lakes--St. Lawrence River Basin Water Resources Compact","Sen. Levin, Carl [D-MI]",07/23/2008,,,,15,"House - Judiciary | Senate - Judiciary",10/03/2008,"Became Public Law No: 110-342."
"S.J.Res. 35",https://www.congress.gov/bill/110th-congress/senate-joint-resolution/35,"110th Congress (2007-2008)",,"A joint resolution to amend Public Law 108-331 to provide for the construction and related activities in support of the Very Energetic Radiation Imaging Telescope Array System (VERITAS) project in Arizona.","Sen. Leahy, Patrick J. [D-VT]",05/22/2008,,,,2,"House - Transportation and Infrastructure | Senate - Rules and Administration",10/03/2008,"Became Public Law No: 110-341."
"S.J.Res. 25",https://www.congress.gov/bill/110th-congress/senate-joint-resolution/25,"110th Congress (2007-2008)",,"A joint resolution providing for the appointment of John W. McCarter as a citizen regent of the Board of Regents of the Smithsonian Institution.","Sen. Leahy, Patrick J. [D-VT]",11/16/2007,,,,3,"House - House Administration | Senate - Rules and Administration",03/14/2008,"Became Public Law No: 110-197."
